,comment_id,text
223,gh1lgyl,"Overlooked part: “I don’t want to be like anyone or anything anymore.”  Proceeds to transform into a villain named Cheetah, an existing animal that was never named on screen except in subtitles."
224,gh1k7x9,"""I want to be the very best

Like no gemologist was before"""
225,gh1j831,"It was too hot, he said it when he got it"
226,gh1kj70,The toppings contain potassium benzoate. That's bad.
227,gh21xg0,"Steve Trevor showing up would have been a lot better if Maxwell Lord had the telepathic powers he had in the comics. Use the powers to make Wonder Woman think he's alive again, manipulate her into doing Lord's bidding or to distract her from whatever his evil plan would have been instead of the stupid wish shit we got."
228,gh4bl8w,"This is an example of how sloppy the movie is written.  The entire movie is about the power of the truth, and Diana flat out lies to Max Lord.  She could have simply said ""I don't watch much television"" and it would have made more sense."
229,gh1pt6q,Needed to set up the weightless physics as the norm.
230,gh1ra75,"It’s not even Olympics , it’s Amazonian Next Top Ninja Warrior, live tonight at 7:30."
231,gh1xjjd,"They needed to build up to the moment when Robin Wright says, ""cheating is bad,"" and then completely forget to recall that moment at any time later in the movie."
232,gh1wclz,I think she was wearing it under her clothes. I thought it showed her taking her shirt off as she got out of the truck and the armor was on underneath.
233,gh3i7ic,[deleted]
234,gh3k1wb,"> ""You can ask an audience to believe the impossible, but not the improbable.""

All you gotta do is follow your own rules. You get to make the rules up at the start, but once you are set on them no do-overs."
235,gh1mh2y,"Now we have TWO Wonder Women who saw what Hitler was up to in the second world war and were just like ""okay, you do you dude."""
236,gh1lp7o,"Most clever part of the movie

Low bar, but yeah"
237,gh1oeiz,Pretty much what happened tbh
238,gh1rhrm,"Yeah, when she started monologuing her inspirational speech, that was all I could think of."
239,gh1qt1g,Or hand Maxwell a Pepsi.
240,gh1nsoy,[deleted]
241,gh59jfx,WHAT THE FUCK DID THIS EVEN MEAN
242,gh1l23r,Also I don’t get how Diana wasn’t the least bit bothered she essentially pulled him out of heaven.
243,gh1mwza,He thought he went to the good place. Chidi and Eleanor don’t fix the afterlife until later than 1984. Had been hundreds of years since the last person got into the good place.
244,gh281u6,"I honestly wished the movie was as campy as Pedro Pascal, it did not need to take itself as seriously as it did."
245,gh5esa4,Well it's a good thing she's transitioning to  *checks notes*  Star Wars.  Shit...
246,gh1p6za,"They needed fireworks, but didn't bother to establish it was the 4th of July in any other way.

Tldr. Bad bad bad bad writing. Not that this is what makes it bad, it's the least of the scripts problems, but if they can't make a coherent plot, there's no way they care about details like this."
247,gh1pmh0,"I kept thinking, wait why did she lasso them AGAIN and drag them into the bannister AGAIN just to jump down all weird. That scene went on for WAAAAAAY too long."
248,gh1s6hq,"Gadot wasn’t selling it for me this time, especially considering she basically saved the world with a speech.

And as much as hate to rag on a child actor, Max’s son was not great. 

Liked Kristen Wiig though."
249,gh1uqcs,">The robbing scene in the mall felt almost like a parody scene haha

I felt like I watched Diana glide around that mall for 30 minutes"
250,gh1tr5q,I thought the mall scene was so silly and slapstick it was going to be revealed it was a tv show. It wasn’t.  And the movie never got better.
251,gh1kve7,"Chris Pine was great. Pedro Pascal chews scenery like the best of best even if it makes less than zero sense. Wiig did a good job considering what she was given. Gadot? Never been a great actress and it shows here a LOT given that the script was not all that good either. 

Lackluster acting plus bad writing equals bad, bad movie."
252,gh1n3w6,"Oh, and enough fuel to fly from Washington DC to Cairo... and back again."
253,gh1kicv,"Dude even called them ""jets"" which I doubt a WW1 pilot would do."
254,gh1omx6,Pedro Pascal do be having a father theme in his works this year.
255,gh2qw6u,"Things that give me some hope for RS: Geoff Johns won’t be anywhere near the script & Disney wouldn’t let a Star Wars movie release with special effects this fucking terrible (yes Star Wars has had its share of questionable shots but never an entire movie of crap CGI). 

But overall, yeah I’m worried. This seems to be her first complete misfire though so maybe not all is lost yet"
256,gh1q2pp,"She stretched her arm in front of her parallel to the ground, so its flying according to superman"
257,gh297yp,"When she dropped the thieves on the police car they would have absolutely died or been critically injured... I mean they must have fallen several stories, and absolutely crushed the car in. Negative effect of Barbara (Cheetah) was that she would lose her empathy. All the rest of the things you brought up... yeah I've got nothing lol"
258,gh1jl35,"It was convenient that the kid came running out of the forest adjacent to where his helicopter landed at the end.
Like the city is a warzone and he finds his kid immediately by getting out of the chopper and yelling."
259,gh1q0md,"I felt they should have had him really bond with his son a little more. Instead, it showed how annoyed he was that it was his weekend to have him again, so I didn’t believe that he’d give up all his power for the kid."
260,gh1off8,“This is bullshit everyone knows you wish for extra wishes first.”
261,gh1lfas,"We figured out how to make web slinging look good 20 years ago, why did it look so bad here"
262,gh1jilg,[removed]
263,gh1mu0o,The entire movie just felt... off. It’s one of the weirdest movie experiences I can remember.
264,gh1jg9q,Horrible writing. DC dropped the ball on their only good movie line
265,gh1jyd3,"Reason number 9,000 why Geoff Johns is not a good screenwriter."
266,gh1jl37,"I liked the first film as well, but both felt long to me too."
267,gh1sr5j,Hahah my first thought during the first half hour was that this reminds me of Rise of the Silver Surfer
268,gh1nx3x,"**70** Years!!!!!

WW1, not WW2."
269,gh1kflo,"It just got more and more absurd as it went on

Here I was thinking Steve magically knowing how to fly a fucking jet was the most absurd thing I’d see in that movie. Like knowing how to fly WW1 planes *does not* translate to fighter jets lol

Then the rest happened"
270,gh1jhnf,I enjoyed watching Steve explore the 80s more than anything.
271,gh1kxi3,"I hate to say it, but I think the film's biggest issue was its writing. 

They didn't bring Allan Heinberg back, who was responsible for most of the first film's script, and instead Patty Jenkins and Geoff Johns got top billing, the latter of whom mostly writes for DC shows on the CW. As good as a director Jenkins is, most directors also aren't spectacular writers, and it kind of showed here that she didn't have a partner who could really lead her through the process.

It was really episodic and didn't really have any semblance of a plot or direction for its first 90 minutes. I don't think its nearly as bad as some people are making it out to be, but it really, truly needed a better writer and screenplay."
272,gh1ku2i,"I thought Patty did a great job with the first one, but this was rough. This movie was legitimately an hour too long, and the screenplay was just messy and contrived in general. Makes me nervous that she’s taking on the next Star Wars movie, but I know she’s capable and not everyone can have a perfect track record so gonna stay positive!"
273,gh1wehk,"YUP

Movie was trash, no question but my mans Pedro did a great job chewing the scenery like it was fucking sugar coated"
274,gh2b8gd,"That was actually a ticket receipt, not the ticket itself.  They print them on the same-shaped paper as tickets/boarding passes.

Everything else is on point."
275,gh1luuy,"I think the idea with Lord is that he just wanted to have a successful business, but the power of the stone caused him to want more and more as he dived deeper into chaos. It’s not explained well.

Kristen Wiig was good but definitely not used well towards the end. I wish Barbara had a “come back” moment after she recanted her wish and realizes she doesn’t need to be Diana to be liked, and they could have buried the hatchet and she could have gotten her guy. Comeuppance! Instead, she stopped being cat lady and I’m sure this scene got cut for a shoehorned, super obvious Christmas reshoot scene."
276,gh1ld19,His motive was to save Grogu
277,gh1lynf,"Maybe it’s because I have little knowledge of Cheetah or had low expectations of Wiig being a super villian, but I think she knocked it out of the park with what she was given (let me be clear I enjoy Wiig as a comedic actress, but if someone said name ten female actors to be Cheetah she wouldn’t be on my list). Maxwell goal was to be more and to have no one be able to view him as someone lesser."
278,gh1qtgv,I swear those bank robbers could’ve been replaced by the three stooges and it wouldn’t have made a difference.
279,gh1knbe,">Chris Pine reacting to everything like this: 👁👄👁

Somehow didn't know what fireworks were."
280,gh1jmxj,Steve existed more just as a direct plot device for Diana this time around rather than as a character himself. It certainly fits the story but it’s also unfortunate.
281,gh1jz9z,He has no idea how an escalator works although kids can figure it out quickly.  And then he flies a jet no problem.
282,gh1z1z9,"Yup, HBO pulled a fast one on us. They kept a lid on how shitty it was and parlayed it into a bunch of new subscriptions."
283,gh38adv,"That book/writing part was semi-realistic, but that guy was not Mayan. See https://en.m.wikipedia.org/wiki/Maya_codices."
284,gh6ryig,Because every 80's movie has to have a mall scene because malls were big back then.
285,gh2f1eo,We just call that Mega-Chemo
286,gh4m951,"I don't know, the movie didn't really make it clear enough if Maxlord renouncing canceled all the wishes or if everyone had to cancel their individual wishes. Because I bet a lot of parents would be fine giving away their life force (or what ever Maxlord asked for) for their kid to be cancer free, for example."
287,gh1uv83,The entire movie had protesters holding no nuke signs. You’re telling me none of them (even while the nukes are literally flying over them and the emergency alert system is saying they have 4 minutes to find shelter) wished for the nukes to go away?
288,gh1qizh,"First in, first out."
289,gh27rfg,"There had to have been thousands of nihilists wishing for the immediate apocalypse, there is just no way earth survived even five minutes of an entire country having the power to wish whatever they individually want. And then what, *everyone* takes back their wish?! Not to mention things seemed oddly normal? Like if millions are wishing for whatever shit they want there’d be dinosaurs and giant rick and morty characters destroying New York."
290,gh65osi,It wasn't even her boyfriend. She was willing to kill a random stranger dude for it.
291,gh2hla1,And stole 100% of his scenes.
292,gh1vvyc,Surely tons of people were wishing for dead relatives to come back at the end too
293,gh28ro2,Steve Trevor was in this movie because Chris Pine.
294,gh1rn3z,On like the fuckin freeway at that. He covered some ground
295,gh1u9j8,My girl and I were like “why are there zombies chasing a kid?”
296,gh1p3g3,Probably has the shits now though
297,gh1t0vm,"Nah, it was so they could make a toy with her in it to sell to kids."
298,gh26xfj,It killed me when she was like “everyone gave her their armor so she could stand and keep the men back” and it cuts to some eyes sitting in a scrap heap with Game of Thrones extras going bananas outside.
299,gh27pkf,"I AM NO MAN!

*Stabs Wonder Woman*"
300,gh7rhnr,Even they forgot it was set in 1984 with the modern signs in the DC Metro
301,gh7ynxv,"The president could have been Ronald Reagan, but nope, was a generic dumb movie president"
302,ghdw3jr,I think the only reason it's set in the 80s is so that the nuclear war scenario between USA and Russia seems more plausible.
303,gh58nay,Yep. About the only thing that it set up was fanny pack jokes
304,gh7ydao,"In a movie *filled* with bad plot points, this absolutely takes the cake. 

If for no other reason than it makes WW an objectively terrible person. 

And they never even let her atone for it. Even when she recants her wish, she never showed concern or thought for the dude. 

What the fuck are they thinking in the writer's room?"
305,gh1tzxs,About the cocain thing. They definitely had a shot of Max in his office taking a quick snort then wiping it away
306,gh2i2qr,"Speaking of wishes by kids, where's the bat shit insane things 4 year old are wishing for? Dinosaurs, unicorns, etc.

Also the laws of the wishes were changed on a whim. Some were manifested vaguely (i wished for a farm guy having cows dropped next to him) some were manifested with logic (nukes being placed into silos all around the US)."
307,gh2m2l3,"Yeah, movies always seem to forget that the Air and Space Museum is in the middle of downtown D.C. and doesn't have its own active airstrip."
308,gh1y1yp,[deleted]
309,gh4cmhg,"I thought that at first too, but that would have been way too logical for this movie."
310,gh4rd1x,"There was something in his comic book origins about his powers of subconscious suggestion causing mental strain / nosebleeds, that I guess they felt they had to (try) to tie in."
311,gh29nd6,"There was a disappointing lack of wonder woman for a wonder woman movie. 

&#x200B;

Even her cool golden angel outfit barely got used."
312,gh1s17z,The entire Themyscira sequence served no purpose and could’ve been cut.
313,gh4bs1m,"I mean, have you *seen* how hot this lady is?"
314,gh4mfk7,"To fully functional, maintained, fueled and most likely combat ready fighter jets that double as a museum exhibit."
315,gh3vyxw,This is the best explanation. For sooo many parts of this movie
316,gh23u3r,"For the trailer. Between that, the golden armor and whipping the lightning I was SOLD to see this movie. And none of those things were important to the plot. Take them all out everything still turns out the same. We got bamboozled."
317,gh28seh,"I thought the movie was garbage but the scene established the idea that the truth was more important than cheating to get what you want. So I can say I'm glad that they showed her that importance and that it was important for her speech at the end.

But man... Really disappointed in this movie. But at least Soul was great!"
318,gh1qxbr,She told that homeless guy to stay warm. In July. In D.C.
319,gh1pws0,"I was thinking, ""wouldn't a guy that died in an exploding aircraft possibly have some PTSD issues to deal with here?""

EDIT: Ok, literally 10 of you have let me know he said he didn't remember his death. I got it. Frankly, that doesn't change the fact that this is what I was thinking when I saw the scene, and by the end of the movie, I had no interest in going back to check."
320,gh1prnt,Also Steve somehow didn't know what fireworks were. And decided to fly through them after knowing nothing about them.
321,gh6u27m,CW's Flash has a better running CG than this…
322,gh1x23l,"So many questions! Was he aware? In some sort of magic coma? Did anyone miss him? Did he lose his job after being MIA for like 3 days? 

Would have been great if they ran into his neighbor or family member. Watching Steve bumble through the conversation would have put the conflict front and center. At least that would lay the ground work for an actual moral dilemma for Diana vs the somewhat selfish ""oh no, my powers!"" resolution. This whole plotline honestly felt like an excuse to give Diana transportation to Cairo."
323,gh215yx,"Dude went to bed one night then came to in the middle of the street several days later, in the midst of a massive riot as the world learns magic is real and that it can both cause and reverse nuclear war. He’s bruised from being in a fight and (though he doesn’t remember it), just participated in an assault on the White House, from which their were many witnesses. Also, he hasn’t shown up to work for the past three days.

Honestly, the movie where he tries to figure out what the fuck happened and piece his life back together is kinda better than this one."
324,gh1jd7a,Movie would be a 10/10 if it ended with her saying “you got a rocking penis.”
325,gh1l3zr,Maybe they just cuddled all night :)
326,gh1maal,Now he’s been fired for no call no show at work.
327,gh1l5vx,Didn't think I'd have to consider if wonder woman raped a dude but it's 2020 still so here we are.
328,gh1ktyi,I mean it's a super hero movie. They could have just had him come back. No need for the body hijacking at all.
329,gh2l1eo,"Carthage too. No, I can tell you exactly what happened to them."
330,gh2t4k1,The first movie annoyed me as a history teacher. This one was on a whole different level
331,gh2umhf,[deleted]
332,gh3ccjz,"Some random ""Mayan"" with a book just pulls the plot together for them."
333,gh2503f,Also Steve just knew to fire that missile?? And knew how to fire that missile???
334,gh1sfeg,"my little brother pointed this out to me. He was like ""she flew all that way just to go to her apartment?"""
335,gh1xp88,"You forget the: I also have armor with wings, but they are not really for flying, just to look cool as I drop them on the ground."
336,gh1sq62,"""oh yeah and I can turn just about any object invisible indefinitely and perhaps permanently but I don't that's ever gonna come in handy beyond this one use case"""
337,gh237fa,"did the guy who got coffee in the first wish have ot renounce his wish?   How about the ""clear the traffic guy?  Did the people who didnt know they got wishes granted have to renounce their wishes?

This movie, if you think about it for more the a few seconds get worse and worse."
338,gh3j0r5,I NEED MY VITAMINS
339,gh2rtox,You ever see The Great Wall? One of the shittiest movies I’ve ever seen but Pascal gives 110% like he’s going for an Oscar. Dude never phones it in.
340,gh1z9k9,"Yep, I love him for it"
341,gh552gn,"Yeah to me Pedro was ignoring the fact that he was in a bad movie and trying anyway, while Chris kept turning the bad movie into an enjoyable one for a few seconds"
342,gh5gbnd,I remember thinking that they should just cut out all the Wonder Woman stuff and just have the movie be called The Increasingly Poor Decisions of Maxwell Lord.
343,gh73xqm,"Also her partaking in an adult Amazon competition as a kid, even though the first film established she only did that as a teen?

Her having new powers, like making things invisible, and flying, which she never uses in BvS or Justice League.

And as you said, the supposed plot point of her hiding from the world since Trevor's death...except she's apparently been saving people for the last 100 years, because they show pictures of her at different historical events?

Maybe they're just trying to ignore the continuity and leave the other films behind, but it was still really jarring."
344,gh1kjuq,"“I renounce my wish! I freely give up all the ill-gotten power and influence that’s gotten me here!

...

Oh hey if you guy’s are taking this chopper back to the White House can I hitch a ride? I need to pick up my kid.”"
345,gh1xspp,"Yeah, Max renouncing his wish should've just reset time to when he became the stone. It would've allowed everything to go back to how it was for the world without anyone knowing, while Max, Diana, and Barbara would retain their memories, having made their wishes before."
346,gh1z88j,But doesn’t kill apparently. Just makes her stop fighting... for some reason?
347,gh1q15h,Interesting comment b/c Lord reminded me of Carrey's Riddler in 'Batman Forever' - taking over the TV waves to gain control over a mass population.
348,gh1n28g,"Barbara using electrical lines as a sling shot not once but TWICE! I mean Jesus fuck, it felt like it was directed by a fucking 10 year old."
349,gh1tko8,"All the way from Washington D.C. to Cairo, no less. They would be lucky to get 1000km with the average fighter plane equipped with fuel pods."
350,gh24c2y,That seems like a superpower that should come up more often
351,gh1pbww,"Those kids for sure got broken ribs. Brain damage. Did you see how stiff they looked. Wth! 

When they land it looks like WW is rolling with child mannequins."
352,gh1q9at,"The lassoing onto a missile. 

HER LITERALLY FLYING BECAUSE STEVE SAID THE WORDS GLIDING AND AIR."
353,gh1upma,"When she tumbled with the kids you could tell the kids were mannikins, like blatantly."
354,gh1sn36,"Yeah, the background ... Beyond obvious green screen. 

Really weird considering the budget."
355,gh1qce1,There’s something really freaky about how shes always so upright. And it’s unclear what’s actually making her fast. Are her legs going faster? Longer stride? What’s actually propelling her forward?
356,gh1mszr,They clearly spent no extra money on the CGI with all the time delays lmao. Like they sat on the film for a year and didnt use the time at all.
357,gh1mmuy,"And there wasn't even a line about her getting the speed of a cheetah or something to explain it. Hell, there wasn't even a transformation scene. Like when Lord is giving her powers they should have shown her clothes busting from her muscles inflating and fur showing on her body. Instead she just smiles then a few minutes later shows up as a monster."
358,gh267x3,"One of the early rumors was that Pedro was playing Hades, god of the underworld and of business."
359,gh26dq9,"Right? That whole scene was so unnatural, I thought it was just because they were doing Themyscara Olympics, but nope, the whole movie felt weird and weightless. 

When she saved the bride from falling off the bridge prior to the hilariously awful mall sequence, I knew I was in for something pretty bad."
360,gh1nj8q,"Hey, Diana had a photo of her helping free concentration camp prisoners. They showed it for like 3 seconds.

Which is also kind of a gross photo to keep on your book shelf.

Why does she need a picture of herself rescuing someone?"
361,gh21gz8,"Maybe she was fighting Super Hitler at that time. If you think Hitler was bad, just be glad you didn't see Super Hitler."
362,gh1tsx6,"Yeah whatever stupid message she was trying to send would have worked better as a YouTube video, and then they could have done something entertaining and fun for the superhero movie maybe"
363,gh1uv91,"I was confused how people heard her speech. Even if a camera was pointed directly at her which I don’t recall happening, she didn’t have a microphone.  She just looked directly at the viewer as if that was enough.  Even if the entire room was made of cameras and some suicidal boom mic operator was nearby, I think the whole “chaotic laughter while a wind from nowhere blows around the room and Max Lord says things like ‘I’ll take your health’” might make viewers wary to make a wish to say the least."
364,gh1n11j,He should be all moody about it like Buffy.
365,gh1tywq,Jeremy Bearimy
366,gh1tb0y,"While Pascal did great with what he was given, the scene with him going full Bruce Almighty at the end granting wishes felt very weird. There's only so much maniacal evil laughter in slo-mo you can take before it gets irritating."
367,gh1vom9,"Yes. It was more excusable in the first one because she was a fish out of water but in this one, you could see it was just Gal Gadot playing herself. The writing didn't help and the story spent way too long with her not being Wonder Woman and just being Diana."
368,gh2180k,"I feel like the only reason they brought Pine back was because he actually has the charisma to carry a blockbuster movie, and without him Gadot is like a beautiful wet mop."
369,gh1swd3,In — what? —  the same night?
370,gh1my0a,"I let that little bit slide,as they went to the aerospace museum and surely that wouldve been explained."
371,gh1n54q,It was convenient that the secret service was willing to give a helicopter lift to now powerless dude back to the White House.
372,gh1ov1r,"It was because there wasn't weight behind it. No leaning into a swing, body was weightless. No one watched any Spider-Man or Tarzan films at all."
373,gh1ryge,There's so much to dissect. So many weird choices.
374,gh1y4t0,"Everything felt unfinished. The script, the editing, the special affects. Was almost like a Twilight Zone episode watching it. The mall robbery scene was straight up bizarre. Diana floated half the time like she was in slow motion. The robbers didn't act human. She didn't subdue any of them before bouncing 50 feet away. And everything involving Trevor was off putting."
375,gh1y2mq,"Even more when you consider that in Justice League, even Batman tells her to stop moping about Steve Trevor."
376,gh1mfa8,And... You mean to tell me a two seater training jet cannot fly from the US to Egypt???
377,gh1mjh5,"Can we also talk about how absurd it is how she then immediately learned how to make an entire jet invisible (probably one of the most practical superpowers ever) from just thinking about how one dude did it to a coffee cup forever ago? *THEN* she ""learned"" how to fly after thinking about Steve talking romantic nonsense about the wind

Edit: I get it. She did it to a cup. Doesn't make it less absurd"
378,gh1kk1s,[deleted]
379,gh1trl9,"Dude, at the halfway point in the movie, I went, ""You're more than an hour into the movie and you're still stuck on setup. WTF is going on?"""
380,gh1ud8h,"No, it was to avenge his murdered sister by the hands of the Lanister soldiers."
