,comment_id,text
0,gh327mp,"Of all the ridiculous plot points, the worst for me was the random Mayan shaman squatter. This guy had to be invented to be on screen for 30 seconds just to show us his ancient book. Two of the main characters work at the Smithsonian. Wouldn't it have made much more sense for them to just find this book in their archives somewhere?"
1,gh1s47n,Anyone else notice Cheetah’s arc was basically Electro’s from The Amazing Spider-Man 2?
2,gh1zitc,"Woman: I renounce my wish.

Kid: Mom, my cancer is back."
3,gh1kahb,At least one person would have wished for that guy to shut the fuck up so they could go back to whatever they were watching.
4,gh1vrsv,"Steve picks up a sword. To fight people with guns.

""Don't use that Steve. It's not their fault."""
5,gh2z3zn,After seeing the director split young diana's jump into the ocean into 4 cuts I knew I'm in for a shit show.
6,gh1q008,"Best line of the movie was ""Well shit Diana"""
7,gh2vyt2,"The term ""Ham fisted"" covers the whole movie for me. From showing Wiig's character as nerdy by having her drop papers and not be ""popular"" enough for her adult co-workers to help pick them up to the 20 or so catcalls in a row Gadot and Wiig both get every time they are in public, everything feels like it's trying to beat the viewer over the head. The entire film is a caricature dialed up to 11 just to make really sure the audience understands the already clear points it makes. That's not to mention the plot holes, inconsistent bad guy motive(does he love his son or is he too busy for him,) generally unrealistic ideas(WWI pilot knows how to fly a jet and thinks it's a good idea to fly through fireworks,) and overall unbelievability of the ending. You're telling me almost everyone on the planet got one wish and earth didn't immediately end from the chaos? And further, that thanks to a speech from Diana every single person also decides to rescind that wish when throughout history this artifact ended civilizations because not one person would? I get that it's supposed to be a fun suspension of belief but even so, what it asks of the audience is beyond that and as a result it ruins the feel. The first movie had a magic and weight to it that this one doesn't even begin to recapture"
8,gh1ppk9,Why did Trevor need to come back in another person's body? Was bringing him completely back to life that much of a stretch considering the Great Wall of Egypt just appeared out of thin air?
9,gh1jmf5,Was Max Lord’s kid just sitting in the office the entire duration of the plot? Was he being fed? Did he sleep on the floor and wear the same clothes?
10,gh3fkjm,"Me a few years ago: That was awesome, I wish they make a Wonder Woman sequel!

Monkey's paw: lol"
11,gh1j5va,I like how the movie escalated from a cup of coffee to World War 3
12,gh1pbaf,>!The armor lasted thousands (?) of years and its broken on her first rodeo.!< This is why we can't have nice things Diana!
13,gh1wtlw,"The most retro thing about this movie is Kristen Wiig’s “Oh look, the nerdy girl is taking off her glasses and now she’s hot!” transformation"
14,gh1n2b7,How come nuclear missiles can appear out of nowhere but Steve has to take an innocent man's life to appear?
15,gh1kh5t,How did one person on the entire planet not wish for the world to end?
16,gh1m1ot,So the planes on display outside the Smithsonian are kept fueled up enough to fly to Cairo and back?
17,gh21b6e,Did anyone else think it would have been much funnier if Max had turned into a stone when he made his wish?
18,gh1j7s5,The first 90 minutes could have been 30.
19,gh2v97k,What Smithsonian-level archeologist or gemologist is barehand grabbing a 4 thousand year old artifact?
20,gh2uuzj,"You have state of the art CGI and a virtually unlimited budget, and where does the final battle between Cheetah and Wonder Woman take place? In pitch blackness near some power lines and an electrical substation near a pond. 

I don’t understand why so many of these movies have their major action scenes in the most ill-defined and boring locations possible. The mall and White House scenes were brightly lit, clear, and reasonably well laid out. Why is our final battle so muddy and lame?"
21,gh1wluu,"The moment I knew this was going to go downhill was the very first scenes when it showed a very young Diana training with the Amazons— even though it was **established** to us **very strongly** in the first movie that Diana wasn’t allowed to train until she was caught as a teenager.

Bro did Patty forget the first movie?"
22,gh1k0lj,"Did anyone notice when all of a sudden, “oh yeah it’s Fourth of July” insert cool fireworks scene"
23,gh30pte,I'm halfway through this and I'm beginning to understand why Kirsten Wiig didn't promote this when she hosted SNL last week.
24,gh2unfw,All I'll say is after watching this movie I understand why Warner Bros had no qualms about releasing it straight to VOD / HBO Max.
25,gh97cwx,"WW1: I am a strong, independent woman that need no man.

WW84: I met this guy for 2 weeks 70 years ago, my life is an empty shell without him. I will sacrifice everything and everyone to be with him."
26,gh1iz4k,It seems odd to me that Diana never considered the moral ramifications of Steve taking over some dudes body.  Like not even for a second. And the guy he took over is apparently a cool guy and didn’t deserve to have his body stolen.
27,gh1jq3b,Who decided it was okay for this to be 2.5 hours?
28,gh1lmqt,"It’s weird going into this I thought they would over do the 80s but in the end it was barely noticed or brought up past one or two jokes. We didn’t even get any 80s bangers. This could have been set in 2019 and it would have been the same 

Stranger things gets to keep their 80s nostalgia use crown."
29,gh1puhq,"I can't get over how during the highway chase, the kids didn't give a fuck about a full envoy coming that were firing guns at each other.

Then when she grabs them but then loses control and rolls on the pavement with them, yeah those kids are dead. The dummies were super clear though.

Also Rome's civilization didn't collapse with Augustus Romulus, put some respect on my boy Constantinople name."
30,gh1lha2,Guess she forgot how to fly in BvS and Justice League
31,gh1n5ms,"""I wish they'd send all of you Irish back where you came from"" --Looks outside and sees guy in green shirt getting arrested."
32,gh1yymz,Pedro was really going for it. I will always respect an actor in a shitty movie who says ‘fuck it’ and just dials it all the way up.
33,gh2zwh1,"When she saved the kids she said ""This is our secret"".  WHAT'S THE SECRET?!  Please tell me.  Everyone saw it."
34,gh1uwlu,Suddenly she's swinging around like Spider-Man and flying like Superman...?
35,gh1iyyu,"Me: Hey. I just wanted you to know that you can't just say the word ""wish"" and expect anything to happen.
Maxwell Lord: I didn't say it. I renounced it."
36,gh1jj9n,So she got 7 billion people to undo their wishes?
37,gh1j245,The plotting of this movie was such haphazard nonsense that Diana could’ve pulled out a bottle of cheetah repellent in the third act and it would’ve tracked
38,gh3t28x,Am I taking crazy pills or did they barely use that killer Wonder Woman theme?!
39,gh1izjc,This movie went full Bruce Almighty for a second there
40,gh1jw7y,How can a movie this huge have such bad CGI?
41,gh1k25f,"Did it feel like the physics of the world never felt consistent? Between flying, continuing motion when she lassos someone, and how she electrocuted the cheetah girl while ALSO being in the same water as her. the whole movie felt like too much suspension of disbelief and more like a serious of odd choices.


Also at the beginning the leader of the Amazonian women's (not Robyn Wright) face was seriously impossible to read. Like she never looked interested or emotionally involved just like constipated and confused. So weird."
42,gh1mvjz,Whoever wished AIDS away had to renounce their wish.
43,gh30k9b,"So, did they forgot that Diana wasn’t allowed to train until she was a teenager? 

That was like a whole ass plot point in the first movie. 

And now the entire opening scene is about her training as a child....

Lazy fucks can’t even remember their first movie that they made"
44,gh1ldyd,"I loved the first one, but after this one, I have to wonder if part of their formula is to have an interesting reimagining of a villain for 3/4 of the movie, and then make them look as stupid as possible for the last fight"
45,gh1j9k8,"Anyone else thought the action felt... floaty? Even within their universe, the Man of Steel movies had weight and oomph to Superman's movements and punches. Whereas it looked like Diana was almost gliding along the ground/air with that strange forced slow-mo perspective"
46,gh1jorq,There’s something deeply wrong with the special effects in this film
47,gh1j0gp,"Casting Director: ""So you're going to play a man possessed by the spirit of Wonder Woman's long dead lover who she is still pining after.""

Kristoffer Polaha: ""Sweet. That means I'm going to have some sexy scenes with Gal Gadot.""

Casting Director: ""I didn't say that."""
48,gh2u96g,"""I wish I had an ice cream""

*eats ice cream*

""I renounce my wish""

*0 cal ice cream*"
49,gh1j2by,"“I want to be an Apex predator”

I too want to be Randy Orton."
50,gh1izs7,Do you think the guy who wished for the coffee just spent the rest of the day locked in the bathroom suffering from explosive diarrhea?
51,gh1rfjs,I maintain my original instinct when it was originally announced — Chris Pine’s character should *not* have been ham fisted into the sequel.
52,gh1mf5z,"She lasso'd an RPG and an airplane?  C'mon, man!"
53,gh4b590,"Diana: ""I don't have a television.""

Diana, later on: Has hidden room full of televisions."
54,gh1jpp9,"Bold of them to start off the movie with 20 minutes of uncut footage from the Amazonian Olympics. Seriously, why was that sequence so long?"
55,gh1w2mh,">Villain: “I’m evil!”   
>  
>Diana: “Stop being evil?”   
>  
>Villain: “Okay, then.”

I really couldn’t get behind the story here, or the inclusion of Steve, or Wonder Woman’s third act monologue, or the second act, or the action choreography/editing...but the score and overall aesthetic were nice.

Very average overall."
56,gh1ufie,Not one moment of synth. Why even bother without having an 80s inspired soundtrack. Can you imagine the badass orchestral fight music with touches of retro?
57,gh1kfws,Did Diana spin in the jeep and change into Wonder Woman?  Diana is wearing a white blouse and they cut away to the tanks and back to the jeep and she jumps out wearing her WW armor.
58,gh60bll,"**Biggest missed opportunity:** Barbara & Diana should have *already* been friends at the start of the movie.

The most interesting thing about Cheetah is that she’s Diana’s friend. Diana should feel terrible about having to fight her. The film glosses over this personal conflict because Barbara’s just someone she met last week.

If they were already friends, we could have gotten a couple of scenes showcasing their camaraderie instead of hurriedly trying to establish a friendship from scratch. Instead of random pics of Diana on a farm ranch, they could have been pics of Barbara & Diana from the last few years.

It’s also a unique opportunity presented by the time jump. We would easily have bought that their friendship started sometime between the two films."
59,gh3hir5,"I feel like this movie is a perfect example of that old trope-saying ""You can ask an audience to believe the impossible, but not the improbable.""

Like, stone that can grant wishes? Sure. Wonder Woman's super strength and lasso of truth? Sure. Gods and goddesses and bringing people back from the dead? Sure.

But... sudden ability to turn things invisible? Sudden ability to fly? Swinging from lightning? Super armor that was supposedly indestructible, now being torn to pieces by Cheetah's random claw-swiping? Villain, who is just a regular human, walking through wind that is literally knocking WW down to the ground? WW unable to get the lasso anywhere near the guy but then somehow around his foot? _Everyone_ in the world renouncing their wishes? Not buying it."
60,gh1j054,As soon as she said she never found Asteria I thought 'That'd be a neat Lynda Carter cameo'
61,gh1khfu,Part of me wishes that Wonder Woman had sung “imagine” and that would have inspired everyone to renounce their wishes
62,gh1ka4g,"Steve goes from seeing fireworks for the first time to immediately thinking it’s a good idea to fly a jet though them

That fucking sucked"
63,gh58622,"Anyone else think it's hilarious that the last lines of the whole film are:

>GUY: It's just so wonderful. So many... things.  
WONDER WOMAN: Yeah.  
\[gazes at people laughing, a child lets go of a balloon\]  
WONDER WOMAN: So many things... so, so many... things..."
64,gh1j0bm,"It’s DC canon, confirmed by this movie, that Steve Trevor died and went to The Good Place"
65,gh1l4mh,"WW84 was very underwhelming.  The biggest need was a different editor. You could probably remove about 40 minutes from this movie and tighten up the plot a little bit, and it would’ve been a huge improvement.

Pedro Pascal seemed to be in a completely different movie than everyone else. He was really hamming it up almost to the level of Jack Nicholson in Batman.

Chris Pine and Gal Gadot continued their chemistry from WW, but Gal really seemed to be missing that *spark* which made everyone love her character."
66,gh2vg94,Um...does Patty Jenkins not understand the concept of continuity?
67,gh1juqr,Why were so many people working on the 4th of July? Did i miss something?
68,gh1j2e3,Is it just me or was a lot of the acting just....not good? The robbing scene in the mall felt almost like a parody scene haha
69,gh1qjax,"The ridiculous lasso with a mind of its own. Learning to fly out of nowhere even though we didn't see that in BvS or JL. Lassoing clouds and lightning. Invisible jet with magic tricks. Extremely wonky and dodgy CGI. The inconsistency in pacing and tone. Poorly edited action scenes that is incomprehensible at times. I had a bad feeling about this when they announced Chris Pine would be returning. He was too popular to use only once. It got weirder when they said it'd be an 80s movie. No swords or shields because it's too ""violent"" even though the Amazons are a warrior race and is all Diana wanted to be? Yeah, the signs were clear. The bare minimum a movie has to do is to establish what is possible and what isn't and stay consistent with those. The opposite of ""dark"" isn't throwing all logic out the gate and just winging it. What a bizarre movie this was. 

This entire movie felt silly and unnecessary. The 180 in its tone, direction and cinematography felt too deliberate.. Almost as if Patty and Geoff decided to join in on the internet circlejerk about the tone Snyder set for the DCEU. The first WW was a huge success by every metric - critics and audience ratings as well as its BO performance. It made Patty and Gal into Hollywood powerhouses overnight. Gal went from making $300k to $10 mil. Same with Patty. Why did they completely throw every element of the 1st movie away? We've barely seen Diana outside of her 1st solo movie so there was no necessity to reinvent or revitalize the franchise. Should've just stuck with what worked the first time and given the audience more of the same."
70,gh39qqw,"After spending the mid-part of the movie trying to discover “which god made the stone?”, I was hoping for something bigger than Maxwell Lord on a faux-Star Trek transporter being talked down from his wish-coke binge by Wonder Woman.

Can we reverse the endings of the first Wonder Woman and this one? 

Like, not have Nigel ThornbAres show up in the last part of the first movie and Diana just deals with the fact that evil lurks in the hearts of man and she commits herself to fighting against it because Steve and his troop proved there are good men with honest hearts too.

Then in this movie have the god of “treachery and mischief” who made the stone show up for the end fight? Hell, have the trickster god take the form of Steve... or maybe have the Trickster god be Steve all along because it’s too irresistible to not fuck with the daughter of Zeus using their wish stone? Have Maxwell Lord see that he was never “number one” and was always having his strings pulled so he renounces his wish and undoes everyone else’s wishes, creating a redeeming arch for him and fucking up the gods overall plans."
71,gh1vx36,This did not need to be the same length as Avengers Infinity War lol.
72,gh1jojr,"I absolutely hated the plane scene, the aircraft mechanic in me was just bewildered that a static display jet at a museum would work and gave fuel in it. Also there’s no learning curve from propellor WW1 plane to modern jet apparently."
73,gh1iyxy,Maxwell Lord should have wished for beskar armor.
74,gh1woq1,Well I’m officially worried about Rogue Squadron.
75,gh1jf42,Did that qualify as flying or was it more falling with style?
76,gh1wrck,If it’s a movie set in the 80s why would you only play like 1 80s song
77,gh6sl6h,"I know this movie has a ton of problems but one that just baffled me was when Barbara gave the food to her homeless friend she told him to stay warm.

We find out later the movie takes place around the 4th of July...."
78,gh3213f,"Well, silver lining, that cover of ""Imagine"" is now Gal Gadot's *second* most embarrassing thing she's released this year."
79,gh1y9sp,"Everything about this film felt really off. Bad pacing, poor fight scenes, terrible dialog and zero continuity or logic. 

* So many unnecessary scenes in this film that just seemed to be there to pad out time.

* What was the purpose of the first sequence with Diana as a kid? It didn't seem to have any real message other than to not cheat and to not take the short path but that message is never put in action later in the film... It's not like the gold armour she had couldn't be used if she wasn't ready. She just had the damn thing in her house for crying out loud. Definitely seems like it was a sequence that was made for the first film not this one.

* When she apprehends those thieves in the Mall she decides to completely total a Police Car for no reason...

* They completely glance over the ethical ramifications of her dead boyfriend possessing the body of some random dude... Some could argue she basically raped the dude... At the very least put some innocent dude in harm's way during the events of the film. I really can't see a single reason they couldn't just make him appear in his own body. It's not like the wish can't manifest physical objects which we saw with the Nukes. Maybe if it turned out at the end of the film that they would become a couple I could see some sort of link but they decide to shoot that down rather than just never bringing the dude back up again...

* So Diana can now just whenever she wants make anything invisible... Is this in the Comics?

* So Pascal just walks into the White House and conveniently they have a literal drawing of the device he needs to complete his evil plan... Talk about plot convenience...

* Pedro Pascal performance was decent but the character was really badly written. Never believed he gave a fuck about his kid who just seemed to pop up whenever it was convenient. 

* Another Hollywood, beautiful woman made ugly turns out to be beautiful trope! It's Ready Player One all over again...

* Pilot from WWI who only piloted propeller planes suddenly has complete understanding of how a jet made 40 years later works and handles...

* What exactly was the negative effect that Cheetah Woman had from her wish? I originally thought it was her turning into a Cheetah but that was done by Pascal when he did his broadcast. Was it just that she would turn evil/lose her self? 

* They hype up this amazing armour that the greatest Amazon wore yet it gets torn like paper minutes into the fight... Though I guess I shouldn't expect much from the same civilisation that use wooden bow and arrows against technologically advanced species that have flying space ship during the war against Darkside.

* Diana can suddenly fly by ACT 3 yet for absolutely no reason other than to make a cool shot and use it in the trailer she decided to lasso a lighting strike... Also why can she not fly in BvsS or Justice League?

* The flying scene decided to use one of the most cliche soundtracks you can put in a movie. Talk about lazy and unoriginal.

* That truck fight sequences was so poorly executed, some of the shots were the most obvious green screen last second shots shots I've seen in a film in years. Also the kids randomly playing on the road seems really odd. These kids are probably playing on that road all the time, they're fully aware to get out of the way when cars that you can see from miles away are inbound...

* Why didn't Diana just kill Pascal? They say it themselves they just need to destroy the stone or rescind their wish, I guess she was really banking on that whole ""humans are all good without Hades"" thing. I'll give them the benefit of the doubt that due to Pascal imbuing the stones power it might not work. Though if that was the case if he dies does it mean there's no way to stop the whole thing?

* They show that wishes can kill people so why didn't Pascal get someone to wish for that annoying woman with the Lasso who keeps trying kill him just conveniently dies? It's not like she's too powerful for the stone to work on her as we saw it take her powers away.

* The message at the end of the film has got to be one of the most ironic ones I have seen in a film. Humanity will do the right thing to save mankind! The pandemic proved that to be a complete disgraceful lie..."
80,gh1izfz,Maxwell Lord is very lucky he has Alistair. That little boy was the only thing in the movie preventing Wonder Woman from giving him his traditional [twist top head.](https://comicvine1.cbsistatic.com/uploads/original/7/74010/1360370-wonder_20woman_20v2_20219_2022.jpg)
81,gh5d864,I really wish that this movie had been about Wonder Woman.
82,gh8vqw7,"Me: Man. I wish they can release some of the movies that got put on hold due to Covid 

Monkeys Paw: WW84"
83,gh1jbpk,My dad yelled “this is bullshit” at the tv four times. I mean really yelled. Highlight of my Christmas.
84,gh3zws9,"In the arcade there was Operation Wolf.  that wasn't released till 1987, literally unwatchable."
85,gh5rcht,"My favorite plot hole of the millions of plot holes was when the woman at the restaurant wishes for the Irish to be deported. The guy responds and wishes she would die. She dies. Then later, he renounces his wish, so I assume she'll come back to life. But she was dead, so she has no idea what's been happening or why she should renounce. Thus, the Irish are permanently deported."
86,gh1j07i,It was a pretty good Spiderwoman movie.
87,gh1iz7y,[removed]
88,gh1izkl,That... was not very good
89,gh42bnz,Good idea by Gal Gadot and Kristen Wiig to make something so bad we all forget about their “Imagine” video
90,gh1j3iq,"There were some really solid elements in the cinematography, performances, and music. But dear god was that script in need of another draft or two. It’s a great example of how a movie lives or dies by its story structure."
91,gh1j9kw,"Did the entire creative team from the original get replaced by the folks behind the 2005 Fantastic 4 movie? Cos this was, like, the pinnacle of mediocrity. Two hours of nothing very remarkable. Hardly any action. Tons of contrivances. Terrible dialogue. What happened?"
92,gh1ni05,It seems unhealthy to be this obsessed with a person for 40 years.
93,gh1izbc,I recant my wish to want to see that movie
94,gh1vml1,"Pedro Pascal stole the movie for me. 

Everyone else seemed just there to be there because it’s a 200 million dollar movie.

Chris Pine had absolutely nothing to do in this movie. And same with the rest of the cast. 

Maxwell Lord as a character was fine.. but Pedro acted his ass off in his scenes and gave some heart, cheese and wit to a nobody villain.

The dude probably got paid the least out of the entire main cast but probably should’ve been paid at least the second most because he carried this shit movie on his back. 

Without his performance, I don’t know if I could find much else to say about it. It was just bland."
95,gh2u0pa,I knew it was gonna be rough when she was fighting 4 common criminals for 10 minutes having to recatch the same guys multiple times. She could of just knocked them out. Maybe she wanted to just be gentle she's different than batman? Then she throws them off the roof onto a police car ruining it and probably breaking all their bones...
96,gh35oyw,"Honestly, this felt like a major step back from the previous movie. The special effects look bad, the writing is abysmal, Diana herself felt like she had no real direction, it's riddled with inconsistencies and plot holes, and could have been about 45 minutes shorter. Frankly, I'm glad I didn't have the opportunity to see it in theaters, I would have walked away feeling like I'd wasted my time *and* money."
97,gh47cm4,"“Where is the dream stone?”

“Gone, reduced to atoms.”

“You used it two days ago!”

“I used the stone to become the stone.”"
