,comment_id,text
98,gh1wioe,"I would have been upset if I paid to see this in theaters.

Just so... Broken and unrealistic.  

They randomly find a jet on the tarmac that had fuel and ready to fly.  

He suddenly knows how to fly a jet after his only experience is plane before 1920.

They fly through fireworks, which being dangerous, also somehow lasts a few minutes.  A real jet would have flown through it in 2 seconds.

And since when was it July 4th.  It's hot as hell in July in DC.  No one is dressed for summer in the movie.

What was the point of seeing that contest of hers as a child.  That you can't cheat?  

How did the son go from being in the office to being in the middle of the highway?

How did the helicopter at the end land somehow so close to where the son is?

Flying to Cairo takes like 14 hours or more.  A jet wouldn't have the capacity, even with fuel pods.  Plus, no bathroom?  And she said she would meet at the guy's place the next day?  The travel time would have made that impossible.

For someone so moral, she didn't feel bad for literally raping the body of the man Steve had taken over.  The guy had no say in this.

Missiles appeared out of nowhere. Cows and Porches appeared out of nowhere.  A wall appeared out of nowhere.  Why did Steve not appear out of nowhere too?  What was the point of him taking over another body?

In the White House, she has the bad guy lassoed while the secret service surrounds him.  She then needs to duck into another room.  Why not simply yank him towards her as she did all the guys during the mall robbery scene?  Instead she needs to go attack the secret service and come to him instead?

They find out the guy went to Cairo because they found his tickets in the garbage.  Why would they be in the garbage?  He would need them to board the plane.  If they were in the garbage, maybe he threw them out cause he wasn't going?  It seems a very thin reason to all of a sudden travel to Cairo.  

They stole a plane cause Steve doesn't have a passport. Steve doesn't have one but how do they know the body he stole doesn't have one?

The giving everyone wishes makes no sense.  Thousands if not millions of hippies would have wished for world peace. Yet the world was about to go to nuclear war.  How would it have dealt with that paradox?

Why would people renounce their wishes?  The guy just granted you a wish for a billion dollars.  You have no idea that there is anything negative going to happen.  Why would you renounce it along with the rest of the world 5 minutes later? 

It just seemed that they didn't care about real world stuff.  That's the problem I have with DC movies.  In Marvel movies, they understand that there is a real world out there and they work with it.  In DC movies, you are just expected to believe that no one can tell Clark is superman because he's wearing glasses and Batman, the greatest detective in the world, cares about the name Martha."
99,gh1j124,"Talk about underwhelming. 

Gal Gadot seemed bored as the once fun, inspiring Wonder Woman with jilted line delivery. 

What was Maxwell Lord’s motive anyway? At no point was there a clear, purposeful reason for him to cause such chaos. Then to have no repercussions after everything seemed odd. 

Weird that Kristen Wiig was the least disappointing part of the movie, I enjoyed her take on a role that seemed well outside her usual."
100,gh30ltj,"Due to the overall runtime and questionable decisions made throughout the course of the film, I am now convinced that whoever wrote it didn't have access to the Backspace Key."
101,gh2xyva,“Well shit Diana.”
102,gh3qg86,"As a person who didn't really like the original Wonder Woman to begin with, WW84 makes the first one look like Citizen Kane.  
  
I guess the worst thing in the movie would be the screenplay. The script is terrible and asks A LOT from the audience from a believability perspective.  
  
The close-second worst thing is the CGI. So many scenes were ruined from just really sloppy visual effects. One thing that most modern superhero movies do consistently right is combat scenes, but WW84 couldn't even pull that off properly.  
  
The score was good and so was the costume design, but aside from that, I can't think of a single good thing to say about the movie. Oh, the overall tone of the movie was just fine."
103,gh1ksvc,"Can't remember the last time I saw action/fight scene physics so laughably bad in a $60M budget movie, let alone a $200M movie. CGI mostly bad. Story was a convoluted mess.  


I was pleasantly surprised how natural Gal Gadot's performance was, though. She did a fine job, but the movie she was in sucked."
104,gh3daed,WHERE ARE ALL THE SHOULDER PADS??! And you call yourself an 80s movie
105,gh422sx,"Maybe instead of a 15-20 min Amazon games opener with awful CGI that served no real purpose to the story, how about a five minute scene showing us how Maxwell Lord came to find this stone that grants wishes?"
106,gh4on5c,This movie had an authentic 1980s feel...in the sense that everyone working on it must have been inhaling kegs of cocaine.
107,gh5bfv0,[deleted]
108,ghd99dh,"This movie was so shit, I almost walked out of my own house..."
109,gh1j4nj,Tough when a movie tries this hard to be campy and fun and yet manages to be this boring. For what it’s worth Gal and Chris maintained their great chemistry
110,gh1jnbi,"The mall sequence was so tonally bizarre compared to the first movie and even the rest of this one. So cheesy and jokey. It's like it was taken from a completely different movie. The movie itself was fine, but not particularly groundbreaking."
111,gh1m0nk,"Can we *please* talk about how they straight up used Addagio in D Minor from the movie Sunshine?? It's even officially credited! Even when Hanz Zimmer apparently scored this, they used a score from **a different film.** I have never seen this happen in a large budget studio production. Unreal. 

(Also I doubt Zimmer touched this movie, as a scorer this screams interns' assignment)"
112,gh2w1ts,I don’t know if quarantine has made me a “running time grump” but I just don’t understand why a movie about a guy who turns himself into a “wishing rock” needs to be two & a half hours long
113,gh57z2s,I owe Iron Man 3 an apology now.
114,gh1lom7,"I audibly sighed at least 5x. I can't believe how boring this was, never in a million years wouldve expected that after the first one. The wish power made no sense or was poorly explained. The climax is just Diana sitting in a corner.... Why was it 2.5 hours?! Was the opening scene recycled from the first one? Nothing made much sense."
115,gh1iyho,"i was obsessed with the Diana/Steve relationship after seeing the first WW movie, so i was glad to see the chemistry was still there between Gadot and Pine in this one ... but at times it felt like someone was given millions of dollars to put a ""what would Diana do if Steve Trevor came back to life???"" fanfic from AO3 on film.

my favourite moment between the two of them was their brief conversation about flight, and how Diana loves that Steve understands flight so well (when she can't), in the invisible jet. i wish there had been more moments like that, and fewer of ... the other moments. reversing the fish out of water dynamic between them was fun at first but it got old pretty quickly since every other scene seemed to involve Chris Pine reacting to everything like this: 👁👄👁

edit: i went and reread Patty Jenkins' AMA from 2017 on /r/movies and she replied to someone with [a list of works that influenced the first *Wonder Woman* movie](https://www.reddit.com/r/movies/comments/6gc5mp/i_am_patty_jenkins_director_of_monster_and_wonder/dip48g4/), i feel like quite a few of these were also homaged in this movie too. the homage to the *Raiders of the Lost Ark* convoy chase was a particularly noticeable one."
116,gh1kcsj,Did the executives see the film and think “Hmm... Maybe this should just go straight to streaming.”?
117,gh1j0gr,This has to be one of the most boring and uninspired movies I've watched in a long time.
118,gh9pos9,"For a guy who loves his son, Max Lord sure spends the whole movie wishing it wasn't his weekend to see his kid..."
119,gh34ivw,The Mayan guy was one of the worst parts. I kept thinking to myself is this supposed to be some ancient Mayan text? How did they have printing?
120,gh3iibf,And the guy possessing a Mayan book which they could read and in the **middle of the book** it was described how the Mayan civilization fell apart.
121,gh4kc6y,"For that matter, why even have the initial mall robbery scene?

“Hey Diana, check out this artifact that was recently dug up and sent down to us.”"
122,gh3cw6d,You could also argue Electro took Selina Kyle’s arc from Batman Returns.
123,gh8wuhv,Pedro Pascal was like the evil Bruce Almighty.
124,gh270e9,Exactly my thoughts. Mistreated dork who looks up to hero turned villain with no real reason to be a villian.
125,gh2cc2n,I mean the alternate is for her kid to die in an awful nuclear holocaust
126,gh1poga,And millions would have wished for no nukes. Whose wishes get priority?
127,gh1rtdd,Somebody would’ve said “suck my dick!” As a joke and then a very interesting scene and dilemma would’ve taken place
128,gh1t1vh,"I was thinking about this. For sure with billions of people listening/watching, at least one person would have said ""I wish you would shut the fuck up forever and die."" Someone with anger issues would for sure."
129,gh29a6a,"The amount of times she gave zero fucks about her now miraculously alive boyfriend being put in mortal danger was amazing.

Yeah Steve fight the armored vehicle by yourself, Ya Steve jump in front of my bullet proof body with a serving tray, Ya Steve charge into that crazy woman who just kicked my ass while I sit here on the floor."
130,gh5t3gh,"I was alarmed by some of that first sequence, but reserved judgment. The robber sequence was unwatchable though"
131,ghgmahp,[Never Forget](https://www.reddit.com/r/movies/comments/474qxs/in_taken_3_director_olivier_megaton_makes_15/)
132,gh2btqx,I swear Chris Pine improvised like 50% of his lines.
133,gh26r70,Also season 4 of r/TheCrown in a nutshell
134,gh9m8r6,"Remember kids, if you see a man on the street at night, he's likely a creep that's either going to hit on you or assault you. At least that was my takeaway from how ridiculous the cat calling became. Every man was instantly just a huge piece of shit after dark."
135,gh1t847,"Yea, other wishes had no problem manifesting things into existence instantly. Dont see how a body would be an issue"
136,gh21ieh,"Not only that, but it had ZERO impact on the plot. No moral dilemma, no consequences. Just ""You're back but in a different body? Haha ok."" It was absolutely pointless."
137,gh2itx3,"Well we didn't hear Diana's wish. Maybe she thought, ""I wish Steve was back, but in a different guy's body. I wish for something to be done about that micro penis situation."""
138,gh1pyn1,I liked how he ran away from the door of angry people (or whatever they were) trying to break in through the entrance and then the next scene he is just walking around outside.
139,gh1ur4h,I liked at the end when the office (in DC) starts getting raided and trashed so the kid runs outside and he's suddenly at the landmark mall parking lot (in VA) then his dad Max and him are suddenly reunited in a field (in DC again). Only cooler part was lasso'ing a cloud and flying then instantly having that pimp ass gold wing armor.
140,gh1yyy6,ALISTARRR lmfao I died at that last scene where he popped up out of nowhere from bushes
141,gh5dzhl,"Top shelf comment, right here."
142,gh1kkf1,Cup of coffee guy was the best part of the movie.
143,gh23yjz,"I was still completely baffled by Maxwell Lord's entire motivation and ultimate goal. Also, what happened to the Dream Stone? They mention this Mayan god, but never bring it up again. Was this god manipulating Maxwell? Was he making him sick? What the hell was going on?! It was so confusing."
144,gh1zp3b,And also what could they do to raise the stakes for another movie? They jumped from killing a bunch of people with gas to omnicide.
145,gh1pixh,"I'm not even sure what it meant...like...it was built up so hard and end of the day it crapped out in the first fight.

Seemed like it was entirely for the trailer and that was it."
146,gh1zblc,It was built to repel men.... not apex predators
147,gh3m2b2,They switched it up at least by allowing the nerdy girl who has become hot the ability to renounce her new hotness in order to help save the planet from endless nuclear bombs. To which she promptly says No fucking way I’m all cool and hot now”
148,gh57f6w,I don’t even understand the point of making the movie take place in 1984 because nothing about the movies aesthetic makes me feel like this took place in the 80’s outside of like three scenes where the main source of humor is “look how funny these clothes are!”
149,gh1rij0,Those nukes took the life of some innocent non-nuclear missiles who never hurt anyone.
150,gh2esbn,"> but Steve has to take an innocent man's life to appear?

Not to mention that a glorious hero like Wonder Woman showed no concern, nor did she even question the fact some innocent person had been replaced or erased from the planet. It made her seem like even more of a shallow character to be so excited that her boyfriend is back that she just can't find the time to take a moment and wonder, ""wait.... what happened to the guy who's body he took over?!""."
151,gh1qwjh,"I think it was because Dianna wished upon the actual stone of the god of lies. And the stone itself made it half believable. Normal monkeys paw dynamics mean the consequences must *slowly* reveal themselves, are ironic, and must be proportional to the greed of your wish. Which is why “I wish for coffee” guy only had the coffee be a bit too hot.

Maxwell deep in his Cocaine/wish binge was like “fuck it, the missiles and the Porches appear out of thin air! And the consequences are whatever I want or need from you at this very instant!”"
152,gh20p60,"why did the Russian nukes in the air disappear when the wish was un-done? Only the US ones were wished for, the Russian ones were “real”..."
153,gh1s24k,"Or one little kid going ""I wish everything was normal"""
154,gh241o6,Wishing for world peace is also pretty standard
155,gh20bo7,And there's a runway with a manned control tower and functional radar? And a *Smithsonian police*? *What?!*
156,gh1q9dr,"Plus he would’ve needed to refuel at least 5 times in that jet, let alone he moved from flying planes made from literal sticks and cloth to supersonic jets in an instant"
157,gh2fm1j,"I honestly thought that he was and that’s why he was getting such headaches after every wish, that he was slowly turning into citrine... that would have been kind of cool."
158,gh29p1c,"""I wish to be the stone!""

\*turns into the stone, later Diana tracks it down and destroys it\*

\- HISHE"
159,gh1ptw2,"Very accurate! 

It was about the time they were driving after Lords convoy k thought to myself ""there sure hasn't been much wonder woman in this wonder woman movie...""

I guess the filmmakers had the exact same realisation because her costume suddenly changed and she was kicking trucks."
160,gh1uyje,The opening sequence was 15 minutes before the title card popped up and then we had another 20 minutes of her being a hero. I feel like we had two openers and they said to keep both in.
161,gh1w4fo,I paused it during the party scene right when Wiig walked in and the movie was already 40 minutes in. I was shocked since literally nothing happened to justify that runtime.
162,gh2xt3t,Or what cultural anthropologist has no-questions-asked access to jets?
163,gh3oluw,It was the 80s baby. We all played a little fast and loose.
164,gh2w22o,Because the darkness hides the atrocious CGI...
165,gh1x96k,Not to mention... What the hell was that whole sequence supposed to establish? It was overlong and showed nothing we didn't already know about the character.
166,gh1pnl1,They didn't even bother setting it up with like a throw away line about forth of july plans or something. Also nobody's dressed like its july. Barbara was walking around in a fur coat!
167,gh1n4si,"The whole time I was thinking ""wouldn't it be really dangerous to fly a plane through fireworks?"" but maybe I just don't know what I'm talking about"
168,gh1ob12,"4th of July. In DC. The hottest, most humid time of year. 

Let’s wear a track suit."
169,gh1muh7,Also flying the jet through those fire works wouldve taken all of 2 seconds and yet we got a 5 minute scene of what the fuck is going on?
170,gh329pv,She didn’t know if she was in Wonder Woman or a sequel of Cats.
171,ghbbp7q,"More likely she didn't promote it because she felt like HBO had screwed her by releasing it on streaming (and thus losing out on the Box Office bonus she hoped for). [Gadot and Jenkins got bonuses regardless](https://screenrant.com/wonder-woman-1984-gal-gadot-bonus-hbo-max/), but I haven't seen anything saying Pascal, Pine, or Wiig got anything."
172,gh2v077,"Yup, I don't know how anyone saw that finished project and didn't try to have them fix the CG once they delayed the release. They had an extra year to fix it there was no reason it had to look so bad besides WB just trying to cut their losses."
173,gh1j6f9,Right? I expected to find out that the guy had just died or something but nope they just highjacked his body and his consciousness was pushed away somewhere?
174,gh1j7aw,"In that final scene Diana is thinking to herself, ""You don't know me but I've seen your penis."""
175,gh1kcv5,Diana was so mindless in this. Seemed like she was just reacting to everything. Her 'heroic' moment was just an IRON GIANT 'You Choose' speech at the end
176,gh1k9y3,"And she IMMEDIATELY had sex with him, after asking ZERO questions about how the mechanics of his survival worked"
177,gh1jw10,Did that guy have a job? Friends? Family? Is he dead? Sleeping? Trapped in his body? Is Diana paying his rent? Can he sue for trauma? Did Wonder Woman just RAPE A MAN?
178,gh1jesf,Yeah. Definitely feels like lazy writing not figuring out a better way for him to come back.
179,gh1m0f8,imagine if it was superman sleeping with a lois lane in another woman's body. So weird that they didn't write this better.
180,gh29kub,Why does DC want all of their movies to be tragically long ass epics?
181,gh1sce3,I thought the movie was going to end at the White House... but then I thought “wait this is Barbara’s and Diana’s first conflict” so I knew there was more coming up. But I didn’t know it was going to be for so much longer 😭
182,gh3au5t,"it was set in the 80s, but it's disappointing because I think we all thought it would CELEBRATE the 80s like stranger things. Even the trailer played that up. But in the end it's more like watching a movie that just happened to be filmed in that time period."
183,gh278pa,"“All of the civilizations had mysterious catastrophic collapses”

Ah yes. The completely unstudied history of Rome’s demise."
184,gh1z0ld,"That scene was almost like a parody. Typical trope of the good hero saving the innocent people and letting the bad guys go, but they were in the middle of the desert."
185,gh1msig,She needs her heart broken to fly. Duh. Favorite part was when she was like “Fuck I forgot my armor better turn around”
186,gh1pv53,"Movie Trailer: I'm fucking badass, look at me using a lasso on the lightning. Hype it up, baby!

Movie: I'll learn to fly right before that scene; lol wtf am I doing using a lasso on lightning. I can fly. 

Turns out the coolest part of the trailer was a pointless scene."
187,gh1p00o,[deleted]
188,gh1rfxx,I mean she was a master Javelin thrower at 12 but was like no Supes you should definitely fly this spear up there and die in BvS.
189,gh1upbo,"They also use ""getting over Steve"" as her arc in both this and JL. How empowering is a female protagonist when she can't move on after losing a boyfriend for EIGHTY YEARS."
190,gh1unpt,"Also, the woman who made the wish died...and came back to life a few minutes later. So how did she know to renounce her wish? 

The convincing billions to renounce their wish part was idiotic as fuck. I'd rather they had just made everything turn back to normal when Max renounced his wish."
191,gh2npvh,"“This is a kids movie Pedro but it’s set in 1984 and we need you to act coked up out of your mind”

“On it!”"
192,gh1z75a,He acts the shit out of everything.
193,gh2wq57,Pedro and Chris were the best parts of this movie
194,gh2rgym,he carried it. without him i would’ve turned it off halfway through
195,gh48kib,"I loved how he showed up initially and was just hamming it up full on, then switches to desperate grifter, then megalomaniacal, then redemptive good dad. He gives it his all.

Everyone’s shitting on the film, rightly so in its got a lot of nonsensical parts but I was still enjoying it for the performances alone."
196,gh2ah7b,Definitely getting the Jeremy Irons in Dungeons and Dragons vibe.
197,gh1zl3m,"yeah, as shitty as his character was he still managed to be enigmatic. he went full 90s action villain lmao"
198,gh2pmuh,He was the only good thing about the film. Everything else was so cringe and bad.
199,gh46tbn,"Well you see in the first movie and Batman vs. Superman she's been laying low for all these years BUT apparently that's not the case at all. She's been doing all kinds of crazy mind blowing shit for years, but winks and says, this is our secret and somehow nobodies ever heard of her. 

Worst AtTemPT to preserve continuity ever. God this movie is so bad!"
200,gh31m4c,Was that before or after she destroyed the cameras that had already recorded her swinging through the mall.
201,gh2c907,And then she does neither of those thirty years later
202,gh2aofa,"Flying like Thor too, by propelling herself with her lasso spinning."
203,gh1j5t1,"""I RENOUNCE my wish!"" 

Proceeds to get on a presidential helicopter, fly to the white house, and find his kid who's somehow in the woods now. What?!?"
204,gh1ky73,"I, DECLARE, BANKRUPTCY!"
205,gh1oaql,I’m pretty upset that Max undoing his wish didn’t undo everyone else’s wishes. Like how are you gonna get EVERYONE to renounce their wish? Just get the one guy to renounce it which reverses all of the wishes he granted.
206,gh1xls8,"I don't get how this exists in the DCEU. Like before Man of Steel nothing major seemed to have happened before, but apparently in 1984 for a day everyone's wishes were being granted, and thousands of nukes showed up out of nowhere almost ending the world."
207,gh1r3hu,"Swinging from live wires: Ay-okay.
Same live wire in water: Ouch that stings!"
208,gh3tijk,They barely used Wonder Woman
209,gh1ph16,Actually thought Jim Carrey would have made a solid Lord for a while there.
210,gh1klwn,"This confused me as well. Like I understand the odd scene being off but every action scene looked cheap as fuck. Don’t even get me started on that final battle vs Barbara - hard to follow, boring, lack of weight to their punches and awful CGI."
211,gh1ry99,The easy to access plane was maintained and filled with gas and a WWI pilot with potential PTSD was able to fly perfectly through fireworks.
212,gh1u67n,"Same goes for her strength. She struggles with the padlock at Black Gold, but then pushes a loaded military truck sideways down the road at highway speeds. Then only moments she can't push apart the two much smaller APCs crushing her."
213,gh1mm2t,Zeus is her father she can control electricity in the comics
214,gh1m4kw,I noticed the similarities too. A few minutes after Ares & Cheetah revealed themselves they’re defeated.
215,gh1mvfo,"I thought it was just me.  One of the reasons I enjoyed the first film is that Diana didn’t feel like a floaty fairy when she moved.  She’s an Amazonian not a VS model.  She had weight and athleticism to her movements then, this time she felt like she want even playing by the same physics as everyone else."
216,gh1mi9z,"The physics were really bad. The lasso stuff, the scene where WW swooped up the two children in Egypt like none of them had mass or weight. I can get over poor physics in CGI if I'm into the story... so not here, unfortunately."
217,gh1k6f6,that’s my biggest problem. Liked the movie overall but the action scenes looked so light. I think the first one was a little like that but they took it to a whole new level here
218,gh1o12e,The scene in Egypt where Diana was running with the convoy looked absolutely terrible at times.
219,gh1pl0r,"When she gets out of the car and ""runs"". It was like they had Gal leisurely jogging in front of a green screen."
220,gh1lc4y,I’m baffled. This movie has been sitting on a shelf for over a year now. What happened?
221,gh1mlze,"Kristopher Polaha (after seeing Wonder Woman): ""I wish I land the part of Diana's  boyfriend in the sequel.

Monkey's Paw: ""Wish Granted""

Kristopher Polaha: Cool. I wonder what kind of action fight scenes I'll be in? How I'll save the day? I wonder how many time Gal and I will smooch?"
222,gh1ltwd,"Polaha; “Sweet, I this film is going to be a great way for me to break out of Hallmark movies. So what do I do?”            
Casting Director: “So it is going to be Christmas and you are going to see Gal.”         
Polaha: “Okay, and then do I fight some bad guys and do more than one kiss at the end of the film.”         
Casting Director: “Well earlier you show up and say one line. But don’t worry you return at the end and you talk about how beautiful Christmas is. She compliments your outfit and you leave.”        
Polaha: “This is just a Hallmark movie without me kissing someone.”"
