,comment_id,text
381,gh1oe7g,"""oh and let me fly this aircraft into a bunch of detonating explosives""

edit: How could they not use any part of Metallica's ""Ride the Lightning"" even though it came out in 1984 and she literally swung around on lightning and she electrocuted the villain"
382,gh1l6vp,Omg yes! Like his plane and modern planes are so different and she managed to make the jet invisible after it only working on a coffee cup!
383,gh5yrd4,"As an Indian, I was wondering how the fuck Ravi Patel (Indian origin) was playing a Mayan shaman.

https://www.imdb.com/name/nm2201027/"
384,gh24bie,That would have been hilarious if the nukes were appearing and reappearing on both Soviet and US maps and the militaries were all confused
385,gh1xxq6,FIFO this guy has taken Accounting 101
386,gh2hoj9,"I take that back. Diana and Steve in the airplane, just looking at the cloud covered fireworks, Pine didn't overwhelm Godot.

Edit: guys, I didn't mean he isn't as pretty as Professional Model Gal, relax. I think that their acting synergized during that scene. And also during the goodby scene. The pair sometimes play off each other really well."
387,gh28qsx,Then Diana was like “Wish them dead again. Fucking do it.”
388,gh1u8p9,And the next time we see him he just comes out of the shrubs at the White House
389,gh1qce8,"He said when he sipped it “oh it’s too hot.”

Modest wish, modest monkey paw consequence lol."
390,gh1yiry,Moichondizing!
391,gh22cau,Don't forget the Golden Armor Funko Pop to sell to adults
392,gh9bqc5,"I was about to make a comment to my wife during that scene about how the modern day DC Metro wouldn't take much to make it look like the 80s. Then I saw the new digital signs and went, ""well so much for that."""
393,gh2hhxf,"The entire plot-purpose of picking mid 80s was  to draw on the context of a culture where a Max Lord could exist, I assumed. Even if it isn't shown, I'd have to assume he was snorting his company into debt, along with all his other mistakes before he found the artifact."
394,gh2qraq,He does say at one moment “Bring me my vitamins!” I am totally certain he was referring to cocaine.
395,gh2pcgz,"I could probably have forgiven the magical appearance of a runway, but the control tower and smithsonian police was just too much. And literally all just to set up the invisible jet which was never mentioned again and didn't have any lead-up at all."
396,gh2fwmt,"Yup. Dull movie.
Not enough action and Godot struggling to bring life to the character out of costume. And the rest of the cast rarely shine either. Pascal made the most of his character and while Kristen Wiig started strong her character became less and less interesting right up to the dissapointing final fight. And Chris Pine was in some scenes.

Another mess of a DCU movie. Such a shame as the first WW movie was easily one of the best DCU entries. Ignoring the awful ending the first WW was compelling with her in and out of costume."
397,gh1vcw8,Yeah... And spend more of the visual effects budget on the scenes that needed it. There were a few green screen shots that were straight out of a 2009 network series.
398,gh1xk3n,It’s entire purpose was to setup the idea that winning with lies isn’t winning. Way not worth the payoff.
399,gh1wxcy,"Literally the first thing I said when this movie started was “wow, did we need young Diana again?” 

And then that scene went on for like 20 fucking minutes."
400,gh2970c,The marketing team should all get bonuses this year. This movie looked SO DAMN COOL in all the trailers and ads. They made a bad movie look so good.
401,gh2uxh6,Holy crap... Cheetah’s never win.
402,gh20jdd,[deleted]
403,gh1tgow,I'm glad someone else noticed this. Even the guy cheetah beats the shit out of was wearing a trench coat in July. The more you think about this movie the more problems you find. The runtime was also way too long.
404,gh1sxha,I was thinking “does flying a ww1 prop plane really translate 1-to-1 with flying a a modern fighter jet?”
405,gh1sx1x,And fireworks were definitely a thing in Steve’s lifetime.
406,gh1jk2x,I feel bad for the dude. He got down with Wonder Woman and has no fucking memory of it.
407,gh1lqy3,"That would’ve been better, just have Steve return physically rather than hijack another man’s body."
408,gh1lvoq,"Yeah I doubt that anyone would instantly recognize him. It's not like somebody would have stopped and been like ""Hey isn't that Steve Trevor? Pilot and war hero who died over sixty years ago? What is he doing here?"""
409,gh34nmp,"As someone who knows hardly about Rome, it still stuck out."
410,gh1unyl,"DC is small as fuck, she could have ran there in less time. And then we could have explained her flying as due to the wings in the armor. Which would have been consistent with the Justice League and BvS. The writing in this movie..."
411,gh267tl,Also just for merchandising
412,gh2ihhb,Anytime you throw in wishes things get messy quickly unless you are very careful to setup the rules (kinda like time travel)
413,gh4t5bi,"ALISTAIR!!

ALISTAIR!!!!!!"
414,gh1ms9c,"Hahahah exactly!  I renounce all my power, but hey can I still get a ride back to the White House?"
415,gh22tjp,Don't forget the coffee guy.
416,gh1o9bf,I thought: “oh she’s just immune to the electricity” and then she is defeated by getting electrocuted
417,gh1qc0k,A child going from a standstill to 60-80 mph in the blink of an eye would be a gruesome sight to behold
418,gh1s37u,"Those robbers at the beginning of the movie that she just chucks off the roof of a building and land so hard they smash through a car?? 

...yeah, walk that off, boys.  You're fine."
419,gh24yd7,"“Flying is simple. It’s just wind and air. You ride it. It’s like anything, really.”

- Dialogue from a 300 million dollar blockbuster."
420,gh31r9h,She landed SO hard on the little boy. I can't fucking believe they used that shot. I laughed out loud at it.
421,gh1ynhu,"It was like that scene from Spider Man where MJ was just holding a mannequin in a spiderman suit, but at least that has the excuse of being almost 20 years old"
422,gh33wea,"That had me laughing my ass off. Both because of how obviously fake it was and the fact that those ""kids"" got fucking SLAMMED and then just got up and were fine."
423,gh29mgh,The one kid (the one farther away) like literally teleported/vacuumed into her hand at the last second
424,gh29kst,"Her flying too, the first time, just looked like she was hanging on a rope in front of a green screen.

I’m glad I’m not the only one who felt this way."
425,gh25mr8,100% concentrated power of will
426,gh2n9gw,"I remember how they made Captain America runs faster by having him move faster while also pulling a rug on his feet. It looks GOOD.

This looks wrong, but then again physics left the stratosphere for this movie."
427,gh1rhu9,"It's not just the CGI though. During the desert sequence, she opens the door of her car, steps out, rips off her clothes and starts running. It literally looked like the CW Flash. There are thousands of sequences where characters jump out of moving vehicles... Rolling to break momentum is absolutely necessary to make it look realistic. The choices made in this movie were all deliberate."
428,gh1nht1,"Yes, but she mentioned that she likes cheetah patterns high heels in a two second scene early in the movie so there you go"
429,gh279ti,"Oh wow, that would've been amazing. Perhaps a bit too similar to Ares, but at least it would've strengthened WW's identity as part of ancient mythologies. Maybe they could've tied Hades' interest in WW with her killing Ares so it wouldn't have felt like a coincidence."
430,gh1q35j,Where do we go... from here?
431,gh1tjxk,That's still one of the most compelling things to ever come out of a protagonist being magically revived because the show needs to continue.
432,gh1v9hx,Granted! Granted! Granted!
433,gh1z576,"Imagine having to film that scene 
“You’re going to raise your hands a few times and laugh manically for about....5 minutes”"
434,gh2351m,It had no structure and several plot points that were either unexplained or didnt go anywhere. So many choices that led to more questions then answers. The movie had a $200 million dollar budget and I feel like no one sat down and actually read through the entire script from beginning to end.
435,gh227h3,"The robbery scene felt so unreal I started to think the whole scene was them filming a movie or something. It felt like it wasn't really happening, even in the movie world."
436,gh36yw6,"Even Steve at the end of the movie was like “you gotta get over me, there’s a lot of people out here”

C’mon Diana, it’s not cute anymore"
437,gh4y9k1,"When *Batman* tells you to stop moping about someone who got killed, you’ve officially taken it too far."
438,gh1mkgq,That is unfortunately very far down the list of things wrong with that movie lol
439,gh1oqtn,"Honestly, they introduce her learning how to turn invisible, her learning how to fly, and her awesome armor with only like a two line backstory right before the thing happens. 

There was no mystique , no foreshadowing, no build up, no well Written lore in this movie. So baaaaad. 

Like they have the power of Hollywood behind this, Tons of marvel movies for inspiration, and every fucking writer looking for work and that’s what they come up with?"
440,gh1ldgf,Ya I was a bit disappointed in that. I assumed there would be some 1980s plot aspect. Instead I felt like they could have chosen any decade and it would not have mattered.
441,gh1mbwb,Also he was baffled by concepts that were not that wild for his original lifetime. Like a freakin' subway...
442,gh8e2a3,"Honestly, EVERYONE renouncing their wishes was the least believable thing in the whole movie. I've seen 2020."
443,gh1xuez,Lmaooo this movie is hilariously bad
444,gh1rsnm,"Simpsons did it! ""The turkey is a little dry"" line when Homer wishes for a turkey sandwich."
445,gh1te2c,Don't you think that guy has got to be pissed though. People got literally whatever they wished for and this dude wasted it on coffee.
446,gh2l8pp,Can't wait for the Wonder Woman Flame Thrower
447,gh41rhs,She spent fifty years turning a single coffee cup invisible but managed to turn the entire fucking jet like it was no big deal
448,gh2g4v0,"It felt, as per usual for DC, it tried to do too much at once, and ended up not doing anything at all.  

Took too long to get Chris Pine back, took too long for anything to happen with him, then by the time he was gone, the world was already over.   

Introduced the cool armour ""early"" on, did nothing with it, busted it out for one fight that it was irrelevant in and threw it away.  

Opened and ancient evil and then the solution was for everyone on the planet to just say ""yeah nah no thanks"", uh huh okay. 

I was expecting Pascal to take on the strength and power of everyone on the planet and go for an insane 1v1 with Wonder Woman, instead he remembered he had a kid and decided that love beats unlimited power. Not a bad message, but one that doesn't really match his character (as it was presented, at least)."
449,gh25exz,No kidding. This movie was ROUGH with dodgy CGI and nonsensical physics. That lasso was just a get out of physics free card all movie.
450,gh20x69,"But she was also a kid against adults, so..."
451,gh1ytrm,"When she broke the thing with the bow, I was like “Ok, she won”, but nope, that was just stage 1."
452,gh2gip6,DC makes fantastic trailers. Both the Suicide Squad and Batman v Superman trailers generated a ton of hype.
453,gh2434e,"It looked absolutely nothing like 1980s DC. Didn't really feel like the 80s at all for that matter. They couldn't even cash in on the 80s nostalgia wave right. And it's weird because *Joker* actually did feel very much like it was set in late 70s/early 80s NYC despite never explicitly specifying the time period and technically being set in ""Gotham"" rather than New York. So I know they are capable of properly evoking the feel of a specific time and place. But it's like they just didn't even try at all for this one. They just SAID it was the 80s and expected us to just buy it without putting any effort whatsoever into making it actually feel like an 80s setting. And yeah, DC today looks identical to DC in the movies. It's painfully obvious they shot there and didn't even bother to change the slightest details to make it look period correct."
454,gh1xwn0,Almost like a kid telling a lie that keeps folding into itself and getting worse and worse and longer and longer
455,gh22ope,"Oh don't even get me started. They stole a static display aircraft that would absolutely not be full of fuel or regularly maintained and needs an external generator to start plus is a small attack aircraft that in no way has the range to fly from DC to Cairo, flown by a man who last flew a radial piston prop plane and was just introduced to gas turbine engines and who has no idea of the performance envelope of the bird including rotation, stall, and approach speeds."
456,gh1tyvk,Along with Subways and escalators.
457,gh1t8pz,"I see no real reason why the bodyjacking has to be there.       
It does add some interesting questions about ethics...but none of which the film wants to address. So why add it?       
Why not just have steve? The film handwaves ""he's not steve, but we're using steves actor anyway"". So...why?"
458,gh23erh,"""It was such a good coffee 😭"""
459,gh1qii3,Spiderman may be the only comic ive personally read in which the sudden force of being grabbed and stopped actually had a negative impact and killed Gwen.
460,gh1zhcf,And her hair blowing in the wrong direction
461,gh2idkq,Luckily Gal distracted us from Pedro's repetitive lines with all her emoting.
462,gh23ll9,"Not to mention the fact that she didn't need the armor at all when she used it, right? She didn't use it the entire time she was losing her powers. She used it after she got her powers back or am I totally misremembering that part?"
463,gh1y6pg,I think the power of Hollywood was the  main issue with this. Movies that make no sense like this are what happens when you write a movie by committee.
464,gh1p7yp,"I get it, actually. There's clearly some material there, particularly in Pedro Pascal's last sequence of taking off the jacket and looking like he stepped out of the Wolf of Wall Street, and him being an oil ponzi scheme guy two years before the crash, that was meant to be commentary on the relentless hedge fund capitalism that characterized the 80s. He's like a knockoff version of that futurama ""80s business guy"" character, the one with Boneitis.

But I don't know if the script wasn't developed enough or if it was too overdeveloped and too much was cut, but the only time I realized they were trying to say ""look you CAN'T have it all and those get rich quick 80s business guys didn't get it and stock brokers and hedge fund managers now don't get it and you have to live your life and appreciate what's around you"" was in Gal's cringey staring down the barrel directly to me speech where she explicitly said that. 

Poorly done."
465,gh1rhh3,"How else would they have had an excuse to make cool 80s aesthetic ""Thor: Ragnarok"" knock-off posters?"
466,gh1pxvv,"Yeah I was like dude that's just a fucking train, you should know what that is."
467,gh8rn42,"Honestly, it all should have disappeared when Max renounced. Didn't see the need for the kumbaya type ending. Also for everyone in the world wishing crap, the chaos in the city was pretty mundane. Where the fuck are the raining meatballs and unicorns and shit?"
468,gh2ee3o,Like the stiff-as-boards dolls that WW swung over the road and scooped up before they could be hit by the military truck?
469,gh20w6v,"There were just so many things that did not make any sense. It was laughable. The cop screaming, ""It is chaos out here, what do you want me to do!"" I actually started laughing."
470,gh226xh,What DEMON FROM HELL created theeeee! *sobs*
471,gh4671c,"While losing her powers, no less"
472,gh2t3l4,"The armor just amazes me! I told my wife ""It's like they realized the armor was going to be hard to do fight scenes with, so they just made Diana stand there till Cheetah destroyed the wings."""
473,gh2oj9n,"Strongest armor ever that held back the armies of man and never broke...got shredded by a crazy cat lady haha

Pascal was great for the role given to him, but the writing could have been much better for the main villain."
474,gh2a19k,Lol when it was “whipping around” as she stumbles backwards in the...wish chamber. The physics there were hilarious
475,gh24mb1,"Like if they would have gone with Diana just entering adulthood or even teen Diana it could have worked, but she was a literal child competing with trained warriors."
476,gh42hab,"Don't tell me those group of attractive, racially diverse teens wholesomely doing breakdancing in the park wasn't 80's enough for you?"
477,gh39ssg,"The digital signs in the Metro...Like, that's an easy fix if they cared..."
478,gh2hv34,What I'm gathering from this thread is as a pilot don't watch this film.
479,gh2nrxt,And stole the plane from a Museum that didn't open until 2003... The Udvar-Hazy Center.
480,gh1v89w,I thought I was going crazy with that.
481,gh1vmt6,So focused by this and fireworks. Like dude anyone bother to check any details?
482,gh1zdqm,The were in London in the first movie in 1918 and London's first subway was literally in 1863.
483,gh1u7iw,And then there’s The Boys.
484,gh1sxgd,"Dude also lived and worked in London, which had a subway before ww1.  Even that specific kind of train should not have been a novelty, let alone a mindblowing unfathomable tunnel of magic."
485,gh2qvqe,What were those dumbass kids doing anyway. They really couldn’t see/hear some big ass tanks driving down the road with literally nothing else around them?
486,gh2lsr8,Once she's holding them all the military trucks avoid them anyways. She didn't need to do anything there
487,gh29e9a,"lol he was like ""Somebody help me"". Gave me a laugh."
488,gh2ilrx,Yeah she could lasso lighting somehow but the windy dream chamber was too much for the lasso of true disappointment
489,gh25gtw,"Competing and winning handily. Even if she was a kid at least have her be in the race by cheating repeatedly, not by kicking everyone's ass then running into a tree."
490,gh2l18b,"As a non-pilot, that part bothered me to the point I went to take a leak when they were taxiing for takeoff. He just starts fucking flipping switches like it’s a flight sim and poof, the plane turns on and boom, they’re in the sky. Not to mention it’s a fighter aircraft and they sit side-by-side. The movie plot holes are an abomination."
491,gh29fns,"Honestly I thought they were going to a scene of him trying to use a computer and being blown away. Instead they did a subway and an escalator. For a movie dedicated to the 80’s, they really strayed from what truly made the 80’s so timeless. The script really needed a bit more work."
492,gh2l19x,"They had subways in the US back in 1897 in Boston and New York in 1904. One of the stations is Boston literally had an escalator (made out of wood of all things, horrifically dangerous, they just replaced it a couple of years ago)."
493,gh2rk6o,I watched this last night with my mother and said the same thing to her. They were so absorbed in playing basketball in the street that they didn't see or hear tanks and humvees barreling down the goddamn road?
494,gh2rs0w,"A couple of the kids noticed and got off the road, looking right at the trucks.  Did they....not shout to the other kids, ""CAR!"" so they would move as well?

Kids should be required to see Wayne's World.  ""CAR!""  ""GAME ON!"" are vital parts of playing in the street."
495,gh2vo13,This can be said for the entire trip to Cairo. They accomplished nothing there.
496,gh3kd2q,I don't understand what that thing was.  She knocked over the camera then he got into a blue light and apparently everyone could still here them?
497,gh2vfa8,"...screaming, firing gatling guns, flipping & rolling, crashing into each other...

""Ooh, a ball!"""
498,gh34dix,"Remember, this was 1984. Innovative tech like yelling “car” hadn’t been developed yet."
499,gh3ktkg,The movie was filled with nonsense. I wouldn’t worry about it
