,title,review
155," Avengers ridiculing themselves...
","...only to - after almost 2.5 hours of boring preparation - end up in a happy ending and of course more CGI laden version of ""Avengers: Infinity war"" with all the protagonists ever to have been in Marvel movies appearing on screen in a CGI festival which shows the true dilemma of modern movie making and the the Marvel world in special. They wanna pack it all in and in the end they get nothing, mixing it all up in a terrible way. We suddenly have Captain America to hold MjÃ¶lnir, Pepper Potts got a suit and fights (aargh!),Scarlet Witch seems to be the most dangerous opponent to Thanos, Thanos being apparently stronger without the stones (so don't go for them, dumb ass!) and among that all we have valkyrie riding her winged horse, just to mention a few. The only good scenes are the ones with Thor, and they are also the only ones where the emotional side is delivered in a believable way. Which is also a hint where the true magic of such movies _could_ be: telling stories of myths and magic, and not CGI overkill movies. Sadly, that's what we got once more, and the typical US approach anyway. So, this movie is nothing but 2.5 hours of time waste to end up in roughly 20 minutes of senseless CGI pseudo battle. If you watch it to be able to judge for yourself and get another idea of contemporary movie making, you can do that while making the dishes or doing something else useful in parallel."
156," horrible one
",It lacked many of the major events that we were wanting for
157," Boring EndGame
",Overhyped overrated movie. Plot Holes. Ruined Characters. Not waste your time
158," Zero story
","The movie is just very bad writing and is an epic failure for it lacks a coherent acceptable digestible fathomable sensible reasonable story or plot .. just sucks so bad that it hurts
So much is wrong that I can't begin .. but for some reason people are lying .. even critics"
159," The fast and furious of comic book films
","This is hopefully the end of this long standing, inconsistent, money spinning series. And it's also the worst of them all. First hour or so...one or two fight scenes. The rest is back slapping in jokes that you'd have to memorise all the other films to get, long drawn out pointless 'science' scenes or 'hilarious' takes on each characters' past dislike of each other (didn't two used to fancy each other? It's like that never happened), and oh yeh the characters all change...like all the time. Remember when this one was bad and this one was good? Not anymore! And what is with their hair?! At the initial meeting to discuss the film concept did someone just say ""hair. Too benign. Let's jazz that up a bit"" because it's as if one of the Avengers is Vidal Sassoon all of a sudden.This should be buried in a pit for future generations marked ""stop watching after Age of Ultron"""
160," okay, but definitely could have been better
","A lot of the movie was pretty good. the fight scene was awesome, especially when all the female characters got together. however the movie really romanticised tony, which didn't make any sense as it was made clear that he didn't care about anyone but himself, and was unwilling to help save HALF of the universe in case it interferes with his life. in my opinion, seeing someone like nebula defeat thanos would have been better (and fitted her arc of wanting revenge on thanos for ripping her apart). overall, this romanticisation of a character who has spent every mcu movie, especially this one, only caring for himself and refusing to accept consequences for his actions become the hero was disappointing and ruined the film for me."
161," Absolute waste of time
","What a waste of time. I am so sorry for all the Thor & Hulk fans. I really am. Movie makers played everyone for fools with all the hype. Lord of the Rings and Avatar remains my all time favorite. My advice to all those who havent watched the movie yet, please do yourself a favor and wait for the DVD. It is highly likely that you will feel wasted like me, so at least you will have saved the money."
162," Fell at the last hurdle
","I watch all films with an open mind and went into this 3 hour long film without any preconceptions.This film really let itself down. The writers completely changed some of the characters, they tried to make it funny and failed at every attempt where it was cringe worthy and boring. The story was dragged out to its limit and went on for way to long.Don't waste your money at the cinema, maybe Google the outcome."
163," Worst avengers movie
",Too many plot holes and scenarios that don't line up with what was put in place in the previous MCU movies. Massive let down for the entire story arc. Best to have the MCU movies end with Infinity Wars.
164," An emotional marvel
",If u r a marvel emotional fan then the film is for you don't have too much expectations like previous marvel movies
165," Worst Marvel movie in long time. Boring, boring,,snooze fest
",Wow! What a POS movie...So much talking. So much crying.. So much boring no action garbage. These high scores must be paid off. Don't believe the reviews. Stopped watching in one hour..and yes that first hour was painful. I can't imagine fighting thru another two hours. What a shocker. A three hour movie that stinks. Who's idea is it to make movies three hours?!?! Most of them are garbage.Skip this at all costs
166," The most boring overhyped movie of all time
","It just shows the influence of media and the hype on the popularity of a movie.
It was the first time, that I fell asleep watching a film in the cinema.
It doesn't deserve to be among the top 250 movies of all time."
167," Thank Thanos that's over.
",I am literally 3 hours closer to the grave with nothing of note to show for it.
168," a film for kids
",If you are a 7 years old kid or you have a 7 years old mind you will love this movie ...
169," A large mess.
","This movie was a complete mess, after all the years of build up, I didn't care.
It was like putting an entire smÃ¶rgÃ¥sbord into a very small bowl. All the flavours and textures blended and lost their appeal.
Only two characters stood out, Thor and Antman."
170," 3 hours of cringe
","Absolute deconstruction of original characters and the universe, this nonsensical circus seems only aiming to cram as much ""political correctness"", painful attempts at humor and cheap pathos into torturous 3 hours.
One can only wish for infinity gauntlet to snap away the bad acting, horrible scenario and hollywood itself."
171," 3 hours - 20 mins of action
","I was not impressed.
Save your money and time.
Wait till they show this in Netflix
John Wick 3 should have been in this film and story line could have been way better!"
172," These get worse!!!
",I don't really know what all the hype is about. Bored watching this as it's the same again just rehashed. Glad to see the back of the Avengers to be honest.
173," Too many holes in plot and too much emotional garbage
","Some parts were done well, revisiting the previous films was a treat but the film overall was pretty lousy. Cap and Tony's departure were not well executed. There are several reviews already on why Cap's exit was out of character and unlikely, look them up if you don't see it. Tony, always wrong, sacrifices himself finally after a lifetime of selfishness, which is a heroic exit in a way, but was a pretty lame ending for such an important character. The movie relies HEAVILY on trying to pull viewer's heartstrings vice have decent writing and make sense in many ways. The SJW nonsense has been out of control in these movies as well for sometime now, more prevalent in the agents of shield series though tbh. Time for Disney to let it go."
174," Where's the action in a superhero movie?
","Just couldn't not finish it. Felt like a Kardashian Endgame. glad i didn't pay, it any money. What has happened to marvel movies in general are those positive reviews bots or bought? There were less than 1/3 action. The rest were full drama, for a almost 3 hour movie doesn't seem realistic."
175," 2 and a half hours of fluff, 30 minutes of decent action
","I did not care for a single second of what was really happening. Too much emphasis on certain characters while others are left in just to make it seem more ""epic"". Hulk was the only character of any entertainment value. I was more entertained by the audiences reaction to certain scenes than the actual film. The scene where Black Widow dies, the girl behind me whispered to her friend: ""Is she dead?"" Like no s*** you just saw her fall of a cliff and slam on the ground.Besides the 30 minute battle, how they handled Tony Stark's death was well done, especially the funeral. If they ended on that long shot showing all the characters, then I would of liked it a little more, but it just kept going.It bored me to death. I only saw it because on how it was considered a ""cinematic event"" to most. To the lovers of film, I really don't recommend it. Just wait for the final battle to be put up on YouTube or something and watch that."
176," time travel? ideal for plot holes!
","Time travel destroys any film...time travel doesnt exist in the physical world..its an invention of writers and authors to close plot holes and impress audiances...so, any film or book containing time travel, IS A MESS! so, i dont see any reason to grade this movie more than 2 stars...cgi, fights, ok , but a real good movie, must have a believable story! for me, sorry it didnt work...
question...why thor and hulk had to be humiliated so much in this movie ? why toni stark had to die? to offer the framatic essence to the story?is this the end of marvel heroes?"
177," Traumatic Disappointment
","Tone, pacing, character arcs, plot holes, emotional connect, logical depth,story, propagandas, Plot convenience, lazy writing.Overrated, overhyped cashgrab.
(Plot holes can be justified but the emotions, how one feels about it cannot) Endgame forces us to constantly think outside the box about the writing part. Infinity war is an amazing film but how did they manage to get the first one so right and the second so wrong. It looks like they were just trying to copy DC for having a dark ending but even they give a symbol of hope when Superman dies.Shame, a decade of characters development wasted.
..1. Tony has finally moved on and retired having a family, overcoming his panic attacks and anxiety realizing that he doesn't have to save the world anymore, but there you go the writers decided killing the basic true sense of his arc, putting him at the spot to sacrifice himself again like he was going to in all previous films and giving a dark terrible ending hurting every kid who grew up watching him for a decade, they could have sent him to coma like in the comics at least. Then a deliberate attempt by the writers trying to convince all that it was okay to kill him with the Tony's speech. It felt like they had to do this for the sake of continuing with phase 4 in Mcu to make more money so he had to forcefully die because this is supposed to be ending for all.* also this film is lost in itself lacking emotional depth as it is satisfactory to know that he is alive in many other alternate timelines. Whoever accepts this ending has failed to understand this character because all believe he's selfish man turning into a legend. Yes, this time he had much to loose -a daughter but still he was always selfless when it came to saving world like every other superhero in world at any given moment and he always played the sacrifice game welcoming death because he is that legend indeed.
2. Thor was already ruined enough in Ragnarok but they managed to make him a fat joke. Thor rejects the throne in Dark World so he could learn more and protect Earth. But he accepts the throne in Ragnarok because he feels ready and he needs to, also now he's in his most powerful form to rule. But in this film he rejects the throne once again and gives it to Valkyrie. We have a Hulk who doesn't get enough importance not even a minute of solo fight after he got beaten by Thanos in IW. Then comes Captain Marvel who is said to be the most powerful but doesn't get a proper combat against Thanos and gets defeated within seconds.
3. People expected that Steve Rogers will die so they made him live, here he leaves his best friend Bucky without giving him a purpose after all the journey they've been through and letting him to still be a sidekick where he doesn't get to either retire nor be the next captain as he hands over the shield to Sam. Steve decides to go away to live in the past out of nowhere and does not accept his reality though peggy asked him to move on...he could have done that starting fresh in the present and also be a responsibile support system for future Avengers, retirement done wrong.
4. Thanos who is this guy? he's not our villian who we travelled with in IW. This is just a guy who is saying that he is going to enjoy killing people. The writers here are trying their best to make him look bad with new different ideology because the audience somewhat liked him in IW. He is there for the necessity of a big bad guy in the climax.
5. The final war had one of the greatest moment in cinematic history which is the entrance of all heroes that was fun to watch because it is the basic reason- final biggest superhero team up movie which audience waited to see.
After the entrances this turned out to be the worst battle ever where it's all just action without any logic , unwanted humor and forced team up shots. This action flick concludes the ten years of storytelling with a War sequence..whole big battle episode is a disgrace to war scenes of great films where everyone in a war is supposed to be useful.-Being the so called biggest action 3-hour long comicbook event film, we come to a stage just after like 8 mins where everyone is useless without screen time and in the final setup the only one left to face against thanos is again the same Tony Stark who was willing to sacrifice himself for Nth time.-I wish to see the 14 billion ways of Doctor strange which writers failed to work on to make a better film but they chose this because whatever they make because of the hype it was destined to hit big to carry-on the franchise without stopping.A celebration turned into a tragedy."
178," Mind numbing. I just had to turn it off.
","I can never be bothered with reviews but this films rating is beyond a joke.
Plot is awkward and ridiculous... even for Marvel.
Acting is non existent. Direction and editing just feels amateurish.
I couldnt deal with anymore after the 1st hour it was excruciating.
It feels like they gave a class of children the old ""how would you end the avengers"" lesson and just put all the answers in a bag and picked one.... and then just made it work.... or so they thought.
I may feels the urge to watch the 1st half again and hope it inspires me to watch the conclusion but its highly doubtful."
179," Snooze....
","My kids were very excited to see this but I was more apprehensive. Really, the film is far too long, just unnecessarily. Parts of this film were very boring and were an ideal time for a cinema snooze! It had so much more potential but directors lost site of their aim. Disappointed."
180," Incredibly dull finale of an amazing franchise
","The great thing about the Avengers-Franchise has always been this winning scheme:1. A range of very different characters like Thor, Spidey and Strange, clashing together in witty and funny dialogues that showcases just how different they are. Spidey cracking jokes about deep philosophic insights of Strange, while Thor asks about beer.2. Incredible fight scenes3. Both may be linked by a variety of different narrative elements, from film-noir/detective over comedy to splatter.It's an easy base recipe, that may be filled with any narrative strings, so long as they are intriguing.Problem with the Avengers movies and the finale in particular is:The winning scheme is NOT used and the narrative underlying is poor, at best.They picked parts of a variety of comics (like the ""Thor get's irresponsible and fat""-plot), which is ok and linked them very poorly together. It's a series of short plots, loosely tied together with no red line (other than ""Thanos is the Endboss"").Secondly, the acting is poor, apart from Iron Man of course! Even Chris Hemsworth and Scarlett Johanssen do a really bad job at depicting their character. The digitally animated raccoon is a highlight in terms of acting.There is only ONE AVENGER-TYPICAL FIGHTSCENE, which is great, but does not make up for the rest.Foot-Note: As a Non-American, the Glory-Halleluja-Murica focus on Cap is too much. If you're patriotic enough, you'll love it, of course."
181," A horribly, boring and goofy installment. Worst one yet.
","This was a terrible film. I rented it and feel like I wasted my money. The movie is 3 hours long. 2 of those hours is just nonsense, comedy, and jabber. Then you get about thirty minutes of the big fight, followed by another thirty minutes of boredom. The male heroes are portrayed as buffoons, which is indicative of today's masculine-man-hating society. Based on today's man-hating culture, testosterone is evil. Women should be lumberjacks and Seal Team Six. Men should take estrogen pills and ask their wives to open the stuck peanut butter lid. I'm a proud sexist. I open doors for ladies. I also send my lady flowers just because versus craftsman tools.This was one of the worst Avengers installments ever. Writers are so busy pushing their masculine-man-hating agenda by making the two most powerful Avengers (Thor and Hulk) water downed buffoons. They failed to capture the essence of the Avengers. If the Hulk and Thor are not smashing something or someone that is extremely powerful, Marvel isn't worth watching IMHO. They are the ultimate warriors. Yet in this installment, they are childish buffoons. The nadless, testosterone-hating writers of today have devolved the franchise into an Everybody Loves Raymond-esque sitcom. However, Everybody Loves Raymond is better written."
182," Time Traveling is the best Joke
",If u kill your past self how the bloody hell u exists in present ðŸ˜¹
183," Uninteresting
",I did fins thia movie highly unrealistic. There is no chance this could happen i the real life!
184," Bit over hyped I would say!
","Watched last evening on Blu-Ray and was quite disappointed. Should have streamed it for a lot less. What in the world is going on with the writers and producers these days. Plot was weak at best. Time Paradox was poorly done. Character development bordered on the ridiculous. Thor was made into a bumbling drunk idiot, Hulk was....I don't know, some kind of a cross between Banner/Hulk working in a diner, and was nearly useless like in Infinity Wars, Captain American now has and can wields Thors' hammer. What in the world is going on! This unfortunate change started surface with Infinity Wars. They also made sure all the politically correct stuff was jammed right in there. The first two remain the best, don't even bother with the others. Sad!!"
185," Love Marvel, hate Endgame
","Love adventure, superheroes and Marvel, but this movie was awful and completely booring. This should have been made into a 15 minute ending of the previous movie. Don't understand who this appeals to. We were a mixed gender group and all of us just waited for it to finally end. Don't except anything exciting or interesting. The plot is easy to see through and they fail miserably to create any emotional connection with the audience."
186," Telling my 14 year old self...
","Well if I went back in time and told my 14 year old self about this film as she watched the first Iron Man...well she would have been disappointed. This was a horrible, boring film. Waited this long for the film equivalent of a root canal, painful, boring, and way overpriced. Don't feel ashamed if you didn't like this ""film"""
187," One of the most overrated films of all time
","Acting extremely sub-par, terrible story, and a cheap piece of non directional fan service."
188," Cheap sentimentalism and plot all over the place
","This was supposed to be the final movie that crowed the franchise and Infinity War set high expectations. I was utterly disappointed. The plot doesn't make sense and throws away a lot of character development, to the point that some of them are just shallow version of what they were in other movies (and could become).But what really annoyed me was the sentimentalism that permeated the whole movie. It is like you have to shed a tear for every character and the movie is trying to make you cry in scenes that don't move the plot forward. If in Infinity War they really stroke a good balance between action and emotion, here they just are there for the sake of it."
189," Cannot see what the fuss is about
","It's long winded...easily could be half the 3 hours.... Superhero movies are about battles and heroes...not crying and moaning. Watching iron Man wimper off was such a let down. After watching every avenger movie, I am so disappointed. Only 1 good battle, and it's over too quickly. So so so disappointed...I'd take any other avenger movie over this one."
190," Bomb
",Glad I only wasted $4 watching this awful movie. 3 hrs I never get back . I really liked Guardian of the galaxy and infinity war . But this is just trash .
191," You thought Cpt Marvel was bad?
","Watch this movie, it can be far worse! I understand that Infinity War set a high bar but this one is a joke; time travel, better known as ""deus ex machina"" for lazy writing, is primary thing here that was never explained.And trust me, that is the least of the problems!Yes, the effects were nice so hence 2/10 but effects were never so important in Avengers; others at least had some sort of story and action, this one is dull."
192," Couldn't get behind it
","It was somewhat entertaining. But the story was just beyond unbelievable. All the crying and moping and ""we're grieving so hard over here"" was dumb.Cap longingly staring at his girlfriend's picture all of a sudden felt forced. Like they decided last minute how his story would end so now, after I don't know how many movies of him not exhibiting that specific behavior, he's all love sick all of a sudden.Hated the scene where the lady super heroes get together to get the glove to the time machine. I get it, girl power! Yay! But it felt so damn forced I rolled me eyes so hard I saw the back of my skull.What made me dislike the movie most was that despite their best attempts at tying loose ends, it felt like lazy writing. Probably because when they wrote the first three movies they didn't have the foresight to drop (or use) Easter eggs that would be found in Endgame. An example is Cap's sudden longing for his girl.I honestly couldn't wait for the movie to be over. Glad I red boxed it."
193," Watching peices of wood act
","I personally have not been a fan of the avengers since the russo brothers took over. The acting in this film was like watching a middle school play. No emotion from anyone except jeremy renner and rdj. Way too long and the plot was just stupid, i think this goes to show huge budget definitely doesn't make a amazing movie."
194," Extra star for CGI.
","I thought the Infinity Wars was bad, but this has brought Marvel/Disney to a new low. The idea of going back in time and changing the present is as old as the hills, but it also opens Pandora's Box. It means you can do it again and again. Which negates the foundation of reality. This plot, unlike the last Avenger's movie, relies on pseudo-science instead of the supernatural. I love science fiction, but this was anything but. Spoiler: Stark looking at a Mobius Strip and somehow realizing time travel was possible was painful to watch. So then they go back in time, make everything hunky dory, as it was before Thanos, but Ironman get killed in the process. So not only did Marvel kill off it's number one action hero (at the box office), but it showed the world that nothing bad can ever happen, because we can simply go back in time and make it better. Interesting how all the characters scoffed at the idea as well, before they actually did it. Time travel movies are fun, but only if they can never be repeated. Using it as a plot device to restore everything to as it was before, was just a cheap trick. I would have been more impressed if Dr. strange found a new set of stones and changed everything back. As a Marvel fan from the Silver Age of Marvel (1960s &70s) I wish Disney would have stuck to the comic magazines closer and not tried to bring the Marvel universe to a depressing conclusion."
195," Dreadful
","The first part of this film is painful to watch, as there's very little dialogue. The plot isn't much good either. I don't see why people loved it so much. And it's way too long."
