,title,review
228," Russo Brothers, what did you guys do?
","What have you done? What were you thinking? 21 movies in and this is the best you can come up with?
I'm not sure where to start. Have you worked so long on all these films that you got burnt out? Do you hate the Hulk and Thor characters so much that you would do what you did to them?
Time travel to fix things is just lazy writing. Plain and simple. Lazy, unimaginative, boring, and it will always fail to make sense.
Let's just start at the beginning of the film. It's the best part other than how did Captain Marvel finds Tony but we can let that slide. It really does not matter.
Five years later was your first mistake. By doing this you have shown the world is in collapse. People can not move on. Garbage everywhere, everything is in decay. Only Tony Stark has seen to be able to move on and have a child and be happy. Great. This is where it gets bad.
You have made Tony Stark completely selfish again. Just like his first film. He never wants to sacrifice anything of his own to make things right. You gave him a daughter and the second you did that, the second you did that, you had to take her away. You had no choice if you wanted to make it a good movie. That is what he was going to have to lose to fix what had been done by Thanos. But you do not even make it an option.
He stipulates that they can all go back in time as long as they don't change the last five years! Why?! The whole world is in mourning. The world sucks. How many people killed themselves after the snap? How many people lost everything they own after the snap? How many children lost their parents? How many parents lost their children? But Tony is happy, so, that's all that matters. Horrible. You made me hate Tony Stark.
Next point. Why do they need a spaceship to go to Thanos? Thor has Stormbreaker. Stormbreaker can make a bifrost bridge to anywhere! Thor can go anywhere he wants now. Anywhere! No spaceship needed.
Thanos? What did you do to the villain you made so great in the previous film. He has five years in retirement and he's ready to die? Let me explain something to you guys. People do not spend their entire lives to achieve something only to want to die five minutes after they achieve it.
Thanos. Poor Thanos. What you did. Thanos would never, ever just sat there and let himself be killed. He knew when he did the snap that people would come after him. He would have been ready. He would have never of destroyed the stones. They would be his greatest protection.
Now that you killed Thanos and you destroyed the stones, you put yourselves in a box. How can we fix this? I know, time travel. Quantum Realm time travel. Side note, Janet Van Dyne (Mrs Pym) was in the Quantum Realm for 30 years and she aged 30 years. We'll forget about that movie though.
Then you guys think we'll go back and get all the stones from earlier movies. Wrong! You don't have to. All you needed to do was go back and get the Tesseract and the time stone. The Tesseract to travel the galaxy. (Which you really don't need because of Stormbreaker but never mind that) and the time stone to fix the time line. The infinity stones are much more powerful than you guys think or realize. Watch the first Guardians of the Galaxy film if you do not know what I mean.
You guys made the script so much harder on yourselves than you had to be. Maybe this is what happens when people spend too much time on one type of characters.
Did you guys forget who the characters are? Captain America does not look at his own ass and make a comment. He does not care. It is not in his personality at all in any other film. He does not have any vanity. It is one of the reasons that Peggy Carter likes him.
Thor. Poor, poor, Thor. Your lazy writing here is unforgivable. The fat Thor was funny for 15 seconds and then it was irritating for the rest of the film. You should have never of done it. Thor should have been traveling the nine realms with stormbreaker, trying to help those realms recover from the snap. That's what Thor would have been doing. Thor would have tried to do something productive. All of Thor's previous movies meant nothing to you. The character meant nothing to you. How Chris Hemsworth played that part without crying in every scene is beyond me. I hope he was devastated to what you did to his character.
The Hulk? Do you guys even know who he is? You hid him in the infinity wars, it was okay. I got it. It made it different, but not to bring him back or to bring him in the way you did here, is beyond belief. We needed to see that transformation. We needed to see how Banner and the Hulk became one. Okay, forget that, you did let us see Banner in the Hulk form but we never got to see a smart Hulk get revenge on Thanos. A smart Hulk who knows how to fight because he is now smart because you wrote him that he is now smart. Wasted opportunity.
Vision by the way. No resurrection? No mention at all. Really?
Hawkeye? There's a guy that enjoyed the last five years. Maybe Tony would like to lose his family and not to want to change the last five years.
Another problem. After the new snap, when you brought everyone back. Hawkeye's wife came back with her cell phone? He has her cell phone charged and on the kitchen counter waiting for her to come back? Did the cell phone company's service survive the snap? Are you telling me that Clint kept the same cell phone plan for five years? Think about that for a second. And this not something I realized after the film. I realized it as it a occurred, sitting in my seat in the theater. Bad writing.
Romanoff. She never needed to die because you never needed the Soul stone and two things on that: When Captain America returns the the Soul stone, did he see the Red Skull? That would have been interesting. And second when he returns the Soul Stone, Romanoff comes back too! Another thing you guys did not think that through though.
Ant-man? I love Paul Rudd, but Ant man was useless. His daughter does not miss her Mom though? I guess she is like Tony and does not want to undo the last five years.
No Fury and Captain Marvel reunion scene? Why not? Don't really care that it was not there, but hey I should at least mention it.
Back to Captain America. He would never had stayed in the past and married Peggy. He would not have taken her away from the man she winds up marrying and having kids with. He would never had done that in a million years. He would not have abandoned Bucky. Bucky has no family or friends. None. Steve would not have left hm. Steve would not have left all the people that he had met after the snap. Those people still need help.
Let me explain your own script to you. When they reverse the snap and everybody reappears after a five year gap. When Peter Parker goes back to school, half his class is gone. They have all aged and graduated. Make sure you have that in the next Spiderman movie. Plus, the people that came back, did they go back to work? The jobs were still there? How about all the houses that have begun to rot? Who repaired them all? What about people who moved and got remarried? Yeah, let's not remove the last five years. Lets just leave it all intact.
What should have happened is what happens in Marvel movies. It should have been fun. It should have made sense. Captain Marvel, who is really the only one able to hold any infinity stones,should of, with the help of all the other characters, gone back in time. With the use of the time stone and the tesseract. She shows up when Thor hits Thanos with Stormbreaker at the end of Infinity Wars and she cuts off Thanos's arm before he does the snap or takes the glove from him. Then Thor kills Thanos or lets him live for another day and Captain Marvel uses the Tesseract to open a portal and disappear before anyone even gets to ask her a question. Timeline in tack. Captain Marvel returns the Soul stone to a very unhappy Red Skull who is now trapped on Vormir again and Gamora returns from the Soul stone.
Thanos could have been alive and chasing all the other characters. Trying to stop them from undoing everything he had done. Better yet, he should have had an arc and realized that what he had done did not go as planned and in the end he lets them win.
Either way the movie should have ended with Tony giving up his daughter, sacrificing his new family to give everyone else their families back.
After all is done. Captain America could have just retired and passed the mattel along. Tony would have retired too after seeing how great life is with Pepper and then tried to make his daughter again.
All of these endings are better than what you did but they are also not perfect. I just don't have all the time in the world to think up better ways to make other peoples films.
What I do have time though, is to go to movies and enjoy them from time to time and for the last 11 years I have enjoyed most Marvel films. Sadly to say but I think I am done with Marvel. I feel as if you guys, the Russo Brothers have killed it all. All the build up, all the time spending with these characters just so you could change them and ruin them the way you did. I feel as if they have died.
I know my opinion is just that, my opinion. I feel that this movie is this generations Return of the Jedi. I loved Jedi when it came out. 5 years later, I hated it. End Game will be that movie for these young people. They love it now, but give it a few years and we will see.
This I guess is my obituary for the mcu. I felt so empty after seeing this movie. I felt like it was all a waste. I felt like my friends had died or left me and were not coming back. I needed to get this all out of my system and just say good-bye.
I apologize for my poor grammar. If I could get the Time Stone, I would use it to go back to school and actually listen to my English teacher.
This is all a very sad ending to what could have been a great era of movies."
229," Pure garbage
",If you like spending three hours listening to explosions and ridiculous plot then this is the movie for you.
230," Absolute poorly written garbage, Martin Scorsese was right about the mcu not being real cinema
",Endgame is one of those movies that uses the hype and nostalgia of the old ones to give off an illusion that it's good when in reality its unoriginal CGI filled poorly written garbage
231," Absolute total krap
",What have all these peeps seen in this movie i was soooo bored i fell asleep its a waste of3 hours of my life...pls dont waste ur 3 hrs on this
232," Good movie but he doesn't deserve this rating
","I give this movie 1 because of course lower this rating and should lower and be under infinity war.
The end is good but the kill of thanos in the beginning is so bad and get another thanos form another time line i think the main villan is just replace to another and many thing like black widow can't back because it in another time line but we see this green female back??
And when they back in time the director don't give as a master peace if they ask Christopher to help them they film will be like a bomb"
233," Captain America ruins it
",This guy is a horrible actor and ruins the whole experience
234," This movie was the worst, most cringeworthy waste of a good story I have ever seen
","Please don't waste your time with this one. This movie was the worst, most cringeworthy waste of a good story I have ever seen."
235," Don't believe the hype! 3 hours of garbage...
","What can I say but WOW! This has to be one of the most boring movies that I have ever seen in my life. I loved Infinity War but Endgame on the other hand is utter trash. Way too many fanboys overlooking major plot holes.
Personally I would give it around a 6. However, seeing how many people are giving this a 10, to try restore some semblance of balance, I will give it a 1."
236," Endshame
","For a while, the hype for this movie was built up because it was intended to be the culmination of all 22 Marvel Cinematic Universe films. However, taking a look at it now, all I see is that they were lazy with the writing and went with the most predictable storyline possible and used time travel as an excuse to replay their greatest hits. It didn't feel like an original story whatsoever. There are great movies being made with actual heart and soul and I am deeply saddened to say that Avengers: Endgame is not one of them. It lacks originality and whatever originality there is is simply the writers pandering to the fans (eg. Captain America being able to lift Mjolnir). The entire movie also felt as if they expected the audience to have seen every single Marvel movie before it. What of those who haven't? I seriously don't understand how this movie became the highest-grossing film of all time. And now they are campaigning for it to get an Oscar?!!!!! I have to be honest when I say that it does not have my vote. I grew up with the Marvel Cinematic Universe and these characters meant so much to me and a lot of people. They brought people together and this movie only makes them look like a joke. Especially Iron Man, Black Widow, Thor, and Hulk. The Russos thought they were being funny by making Thor into Santa Claus. Well, if they were going in that direction, they might as well have sent him to the North Pole and have him use the Bifrost to send presents to kids every Christmas!!! More efficient than using a sleigh with 9 reindeers!!! No elves needed (proven in Thor: The Dark World which they keep trying to remind us happened). As for the Hulk, he was even more useless in this film than in the previous film! I don't know what they were thinking. When did Shrek get a PHD in physics??? And Thanos at the beginning was just a rip-off of Two-Face from The Dark Knight, a movie that, need I remind you, DID win an Oscar. Might as well have Nebula walk casually out in a nurse costume as the Avengers facility was blown to kingdom come. And don't even get me started on Black Widow's death!!!! They basically just rehashed Gamora's death from Infinity War. Like, did they even get Ross Marquand to come back as Red Skull or did they just use archived footage. Black Widow was a character we as Marvel fans grew to love and relate to because she was damaged, she had demons. She as a character that we as fans who have our own struggles could relate to. And she deserved a better death than that. She didn't even get a proper funeral!!!! That just makes me so mad ðŸ˜¡ !!!! And then Iron Man, The Godfather of the MCU!!! They shouldn't have done that to RDJ. In the film, he starts out in space like he did in the first trailer for the film and then in the actual film, it's only true that he will die in space for, like, two minutes. That is, until, surprise, surprise, Captain Social Justice Warrior comes to the rescue! I mean, she can fly through space and shoot plasma beams but she can't even hold out on her own against Thanos without his mirror-image kitchen knife!!! Even Wanda Maximoff gave him a literal run for his money and when she lifted up Thanos, she didn't look like she was struggling at all, she was all ""please keep all arms and legs straight and enjoy the ride cause you gonna die for killing my Red Tornado rip-off boyfriend."" That final battle has its cringeworthy moments: like that all-star ladies team-up but I've seen grannies walking into a book club meeting look more intimidating than them. I mean, what the hell was Mantis there for? Was she gonna be their cheerleader? If so, where were her pom poms (Ohhhhhh, the actress's name is Pom...Klementeiff. And was that supposed to be funny, Kevin?). Then there was the funeral scene, with everyone acting like the president had died or something. I mean, I bet you Drax didn't even remember who it was that died to begin with and was probably asking himself why everyone was so sad while Aunt May was getting Happy's number (probably when they started dating). And Nick Fury saw the funeral and he was all ""well, I'm done with this planet. I'm gonna ask Carol about that new hairdo cause it's not doing her any favors"" while Carol was all ""I rescued him from space for this?!!"" Nebula was probably even wondering who to play paper soccer with and Wanda was probably wondering whether or not she had to stay in her room. Then you have the Old Man Rogers debacle with Bucky and Sam all like ""oh, yeah, you invented time travel, that's cool, we're just gonna pretend like that's normal and all"" and Bucky thinking ""well, looks like I'm the sidekick now"". Plus, what about all the stuff about the Infinity Stones and branched timelines that the Ancient One was babbling on about. Did everything she said suddenly not matter because it was Captain America? It feels like they only brought in familiar faces because they thought it would look cool in the final battle. The way this movie went down, you would think that the final battle was the ONLY thing that the Russos directed. And the way they opened the film was just so random you didn't know if it was just another sneak peek or not, I mean, of all Avengers, why start with HAWKEYE?!!! I get that they wanted to show the scope of the impact that Thanos had with his Snap but to start with HAWKEYE?!!! They should have left that scene in Infinity War and opened the movie with Carol arriving on Earth or something. There is so much to point out about this movie that it is just exhausting. It feels like another attempt by Hollywood and Disney to make a cash grab and let everyone know that Big Brother (Mickey) is watching and controls all. Not too difficult to imagine an army of Mickey Mouses marching and saluting dear leader (Bob Iger)."
237," Very highly overrated !
","Long, boring, no story, no nothing !
Long, boring, no story, no nothing !
Long, boring, no story, no nothing !"
238," - 1 ! What garbage is this ?
","What's this dribble, there's about 30 minutes of action and it's a predictable boring at that and overall mind numbing silly movie , all but this one are okay , what agenda are the feminists pushing as they try going woke and ending up broke. Shame ,hope you downloaded it and were not shammed out of any money to watch..."
239," You must be kidding me.
","There are endles topics, the sci-fi universe could be so immensely diverse, but only the pure greed and the striving for money making lets us 1v1 with THIS.Why dont we take the top Nebula/Hugo winning scenarios? Because we obviously perceive our viewer through the prism of arrogance and dont evend dare to waste corporate budgets on something worthy.Such a waste of time, ressources and such a stamp on Marvel.Bad, just bad."
240," Bad movie
","I just sleeping in the movie theather, because, okay this is a ""Endgame"", but this movie doesn't have action and i didn't know why this movie don't a sink me."
241," Meet Avengers 3D: Disastrous, Dumb, Dull
","Rated over 8? Am i missing something? Most of the movie is filled with tedious flashbacks and boring confessions from the heroes. In fact, there were so many heroes that my head almost went dizzy, I was expecting someone like Mr. Spongebob or Tom and Jerry to appear at any moment. Maybe it could actually make the movie a little less boring.
The plot was so ridiculous, so embarassing... Same flat jokes, same senseless pathos from all the previous parts, and ZERO logic. They figured out they needed to travel in time, went to Stark, he said its impossible, blah blah... then he sat down for one evening, had another dull sentimental dialogue with his wife and guess what - he made a time machine in one day. Yep. (Oh, and at the same time he also made the exact copy of Cap. America's shield. So basically, if the only special thing about Cap. America became casual, what is even the point of that character's existence?)
In the end, Avengers is just like Transformers: a seemingly never-ending franchise with lots of CGI and the same plot in every sequel. But this time, hopefully, it's the endgame of this horrible money grab of a series. Just dont bother watching it. Please."
242," Time travel ruined everything
","Seriously time travel?! You did the lazy way to kill thanos ,am so furious. That's why infinity war was better 10x"
243," Hounestly a garbage movie
","Endgame is the worst superhero movie I've seen, it's full of lazy bad writing, this is a shame to cinema, endgame was a disapointing predictable end to a mediocre franchise"
244," This was the Second time I walked out on a movie
",A garbage with full of unpleasant characters and boring story and i call that a real charlatanism to stole your money and giving you a 3 hours long headache with minimum suspense and bad cgi and nothing more. i hope we never saw that characters anymore and never have such garbage anymore.
245," A good movie but nothing new to offer.
","Endgame, The Flash (TV Series), and Legends of Tomorrow (TV Series) has many similarities and that bothers me the most. Felt like they stolen the idea & concept of time travel directly from The Flash story line. A big fan of Infinity War. It had original ideas and it was well executed. But I cannot say the same for Endgame.My Rating 6/10"
246," Incredibly overrated
","The only good thing about this movie is the nostalgia of old marvel movies,the time travel logic is stupid and its extremely boring just 2 hours of people morning then 45 minutes of cgi,its a disgrace to movies for this movie to be this high"
247," Why?
","I hate how people are saying that this movie is epic, and that all the movies that preceded it were epic as well. There have only been a handful of Marvel movies that have actually been good, and this is not one of them.Marvel, like The Simpsons, has run out of ideas and is now running off of a therom. If it has the word marvel in it, then it will sell. The story does not matter only the name, and it's finally starting to show, as it has for The Simpsons for years now. And the announcement of new movies is now no longer exciting for me.Marvel honestly needs to take a step back and take their time in producing movies, as well as shows now too, like some of their most fantastic movies and shows, like the original Iron Man, Guardians of the Galaxy, Ant-Man, and even the Netflix Daredevil, which was surprisingly good and did a great job portraying the character. What the executives at Marvel don't seem to understand is that they in fact are not Epic, they're just putting trash out and unfortunately the masses are gobbling it up. Things become like goats, they'll eat anything that you put in front of them.End game is one of the most unimpressive movies I've seen in a very long time. I cannot believe that I wasted almost four hours of my life watching this horrible, sad excuse for a superhero movie, if you could even call it that. The only great thing about the past few Marvel movies is the memes that have come out of it. The Russo Brothers Legacy will be the memes that were made from their movies, not the story itself nor the movies. Just because you have the lucasfilm lighting, as well as the CGI company behind you does not make you amazing. What makes anything amazing, story-wise is a good story. End game doesn't even have that! They paid Robert Downey jr. 75 million dollars for the only good scene in the entire film, and it only lasts a couple of seconds. What a waste of money.For the love of God stop going to see Marvel movies and teach them a lesson to stop making horrible movies they aren't even superhero movies anymore. Stan Lee is gone, even when he was alive he didn't stop these terrible movies from being made, because he believed in Marvel and that it could change the world. In the beginning it did, with the Tobey Maguire Spider-Man's, Iron Man, and all of these amazing Marvel films that were actually well done and good. Stan Lee near the end, just produced these films because that's all that he knew to do. He inherently trusted these people to make great movies, and honestly they failed him and failed the original image of Marvel. Only the comics have stayed true, and even then they've come to PC for my liking, and it's so sad. Marvel won't be getting any more of my money. Hopefully you won't be giving any of yours to them anymore either. I am tired"
248," utter garbage
",Wost movie ever seen total waste of time no action no nothing just bad bad bad bad
249," dont know why it got so much praise
",Marvel man you were ok when you weren't practically wearing mouse ears on your logo but this is a super hero movie and I'm sorry but what was with the reveal of thanos??? I mean if sonic the hedgehog got so much bac lash for its design then marvel should have been working around the clock but no the big bad that we waited 6 years for him to do some damage is a friggin grape this is just snoke form the last Jedi all over again I mean honestly what is with marvel and the black widow love interest I mean yea she's hot but is she with Bruce or hawk eye pick a lane!I mean you know how this is going to end someone has to die and yea i guess people feel for him but lets say someone like star lord honestly he would be a better fit because its all his fault but no we kill off a main character that was so funny and has a cute daughter star lord saw his mother die and got abducted by aliens when he was like eight before he even had time to grieve. Also were do you go when you dust off did anyone else ever think about that I wrote a parody of Gilligan's island about that and did anyone else think that the rat who let Antman out was just mickey in disguise saying be funnier (fake laugh) you didn't make me enough money(fake laugh)because people were grieving over infinity war deaths(fake laughter) man even tonys wife was like ha I aint kiss those crust lips that's why she kissed his bloody burnt face and she hesitated too.
